book_key,question_type,page,text,answer,author_name,book_title,source_name
a-dictionary-of-scoundrels,in-which-book,265,is it suggested that someone is cooked as punishment for allegedly committing a crime?,,Beth Lincoln,A Dictionary of Scoundrels,Lake Oswego Public Library
a-dictionary-of-scoundrels,in-which-book,272,does a feeling of wrongness start in the back of someone's neck?,,Beth Lincoln,A Dictionary of Scoundrels,OBOB Parent Group
a-dictionary-of-scoundrels,in-which-book,273,do mistakes and wrong turns flash before someone's eyes?,,Beth Lincoln,A Dictionary of Scoundrels,OBOB Parent Group
a-dictionary-of-scoundrels,in-which-book,278,"does blood run down someone's wrist, soaking into the white cuff of their shirt?",,Beth Lincoln,A Dictionary of Scoundrels,OBOB Parent Group
a-dictionary-of-scoundrels,in-which-book,294,does laughing gas fill a house like helium filling a balloon?,,Beth Lincoln,A Dictionary of Scoundrels,OBOB Parent Group
a-dictionary-of-scoundrels,in-which-book,294,does nitrous oxide pose a deadly threat?,,Beth Lincoln,A Dictionary of Scoundrels,Lake Oswego Public Library
a-dictionary-of-scoundrels,in-which-book,295,does someone say “he won’t kill me twice?”,,Beth Lincoln,A Dictionary of Scoundrels,Lake Oswego Public Library
a-dictionary-of-scoundrels,in-which-book,302,does a character serve hot chocolate in paper cups?,,Beth Lincoln,A Dictionary of Scoundrels,OBOB Parent Group
a-dictionary-of-scoundrels,in-which-book,306,does a family discover that the greatest treasure isn’t gold but each other?,,Beth Lincoln,A Dictionary of Scoundrels,OBOB Parent Group
a-dictionary-of-scoundrels,in-which-book,308,do the characters form a circle and take turns telling “mostly true” stories about their ancestors while sitting on sacks of old turnips?,,Beth Lincoln,A Dictionary of Scoundrels,OBOB Parent Group
a-dictionary-of-scoundrels,in-which-book,315,does a mysterious envelope hint at more adventures?,,Beth Lincoln,A Dictionary of Scoundrels,OBOB Parent Group
a-dictionary-of-scoundrels,in-which-book,320,does Aunt Schadenfreude fake family sabotage?,,Beth Lincoln,A Dictionary of Scoundrels,OBOB Parent Group