book_key,question_type,page,text,answer,author_name,book_title,source_name
a-dictionary-of-scoundrels,content,3,What is the full name of the main character who believes she is destined to cause trouble?,Shenanigan Swift,Beth Lincoln,A Dictionary of Scoundrels,OBOB Parent Group
a-dictionary-of-scoundrels,content,5,What ceremony gives Swift family children their names and definitions,The Naming Ceremony,Beth Lincoln,A Dictionary of Scoundrels,OBOB Parent Group
a-dictionary-of-scoundrels,content,5,What color is the cover of the Swift Family Dictionary?,Red,Beth Lincoln,A Dictionary of Scoundrels,OBOB Parent Group
a-dictionary-of-scoundrels,content,6,What animal statue guards the entry hall?,A marble lion,Beth Lincoln,A Dictionary of Scoundrels,OBOB Parent Group
a-dictionary-of-scoundrels,content,6,what is the first name of Shenanigan's relative who died in 1889?,Faultress,Beth Lincoln,A Dictionary of Scoundrels,OBOB Parent Group
a-dictionary-of-scoundrels,content,9,what is the name of the catapult Shenanigan built?,Siegemaster 5000,Beth Lincoln,A Dictionary of Scoundrels,OBOB Parent Group
a-dictionary-of-scoundrels,content,10,what is the term for a long wooden musical instrument played in Australia?,Didgeridoo,Beth Lincoln,A Dictionary of Scoundrels,OBOB Parent Group
a-dictionary-of-scoundrels,content,11,What word does Shenanigan wish had been written for her in the Dictionary?,Detective,Beth Lincoln,A Dictionary of Scoundrels,OBOB Parent Group
a-dictionary-of-scoundrels,content,13,What is the name of the Swift who is obsessed with rules and being proper?,Felicity Swift,Beth Lincoln,A Dictionary of Scoundrels,OBOB Parent Group
a-dictionary-of-scoundrels,content,14,Which sibling teases Shenanigan about her name?,Felicity,Beth Lincoln,A Dictionary of Scoundrels,OBOB Parent Group
a-dictionary-of-scoundrels,content,14,"Back in the old days, every child had been named these two names?",Mary or John,Beth Lincoln,A Dictionary of Scoundrels,OBOB Parent Group
a-dictionary-of-scoundrels,content,20,Who is the eldest Swift present at the reunion?,Great‑Aunt Prudence,Beth Lincoln,A Dictionary of Scoundrels,OBOB Parent Group
a-dictionary-of-scoundrels,content,20,In what year was the Swift House established?,1602,Beth Lincoln,A Dictionary of Scoundrels,OBOB Parent Group
a-dictionary-of-scoundrels,content,20,what year was the Swift manor built?,1602,Beth Lincoln,A Dictionary of Scoundrels,OBOB Parent Group
a-dictionary-of-scoundrels,content,23,what is the first name of the character who moved to Denmark after becoming obsessed with Hamlet?,Cantrip,Beth Lincoln,A Dictionary of Scoundrels,OBOB Parent Group
a-dictionary-of-scoundrels,content,25,What ingredient is missing from the family stew?,Saffron,Beth Lincoln,A Dictionary of Scoundrels,OBOB Parent Group
a-dictionary-of-scoundrels,content,29,What was the nun in the painting on the 2nd floor coordior doing?,picking her nose,Beth Lincoln,A Dictionary of Scoundrels,OBOB Parent Group
a-dictionary-of-scoundrels,content,29,what is the name of the painting Shenanigan finds a laundry chute behind?,Nun Picking Her Nose,Beth Lincoln,A Dictionary of Scoundrels,OBOB Parent Group
a-dictionary-of-scoundrels,content,30,Which Swift is an aspiring inventor?,Cousin Crispin,Beth Lincoln,A Dictionary of Scoundrels,OBOB Parent Group
a-dictionary-of-scoundrels,content,33,what is the name of Cook's first horse?,Rasputin,Beth Lincoln,A Dictionary of Scoundrels,OBOB Parent Group
a-dictionary-of-scoundrels,content,39,What poison does Phenomena accidentally make?,cyanide,Beth Lincoln,A Dictionary of Scoundrels,OBOB Parent Group
a-dictionary-of-scoundrels,content,42,Who falls down the stairs and is believed to have been pushed?,Arch-Aunt Schadenfreude,Beth Lincoln,A Dictionary of Scoundrels,OBOB Parent Group
a-dictionary-of-scoundrels,content,42,What room is Arch-Aunt Schadenfreude found in when she falls?,The Great Staircase Hall,Beth Lincoln,A Dictionary of Scoundrels,OBOB Parent Group
a-dictionary-of-scoundrels,content,42,[Two Part Question] Name two ingredients of Phenomena's smoothies?,"Any Two: spinach, kale, cod-liver oil, blueberries, certain kinds of algae, soy sauce, broccoli, or egg yolks",Beth Lincoln,A Dictionary of Scoundrels,OBOB Parent Group
a-dictionary-of-scoundrels,content,45,"Whose name has the meaning ""the enjoyment felt at the misery of others""?",Schadenfreude,Beth Lincoln,A Dictionary of Scoundrels,OBOB Parent Group
a-dictionary-of-scoundrels,content,46,Who does Felicity blame for the missing teacup?,Shenanigan,Beth Lincoln,A Dictionary of Scoundrels,OBOB Parent Group
a-dictionary-of-scoundrels,content,46,"what name means ""to make something better""?",Ameliorate,Beth Lincoln,A Dictionary of Scoundrels,OBOB Parent Group
a-dictionary-of-scoundrels,content,48,What is the name of the nonbinary cousin who has chosen their own name?,Erf,Beth Lincoln,A Dictionary of Scoundrels,OBOB Parent Group
a-dictionary-of-scoundrels,content,53,How did Shenanigan communicate with Suleiman when they were apart?,Flashing torch on/off,Beth Lincoln,A Dictionary of Scoundrels,OBOB Parent Group
a-dictionary-of-scoundrels,content,55,What game do the Swifts play in the dining room?,Hide‑and‑seek,Beth Lincoln,A Dictionary of Scoundrels,OBOB Parent Group
a-dictionary-of-scoundrels,content,55,what is the boiling point of sulfur?,444.6 Degrees,Beth Lincoln,A Dictionary of Scoundrels,OBOB Parent Group
a-dictionary-of-scoundrels,content,60,What does Shenanigan accidentally break that causes a huge family argument?,A priceless vase,Beth Lincoln,A Dictionary of Scoundrels,OBOB Parent Group
a-dictionary-of-scoundrels,content,69,what is the collective term for a group of owls?,Parliament,Beth Lincoln,A Dictionary of Scoundrels,OBOB Parent Group
a-dictionary-of-scoundrels,content,74,What is the name of Covetous' sister?,Vendetta,Beth Lincoln,A Dictionary of Scoundrels,OBOB Parent Group
a-dictionary-of-scoundrels,content,75,What object does Shenanigan believe holds clues to the family treasure?,The Family Dictionary,Beth Lincoln,A Dictionary of Scoundrels,OBOB Parent Group
a-dictionary-of-scoundrels,content,77,what is the first and last name of Candour Swift's fiancee?,Daisy DeMille,Beth Lincoln,A Dictionary of Scoundrels,OBOB Parent Group
a-dictionary-of-scoundrels,content,80,Where does Shenanigan first see the treasure map?,Inside a drawer in her room,Beth Lincoln,A Dictionary of Scoundrels,OBOB Parent Group
a-dictionary-of-scoundrels,content,83,"what is the term for someone being kind or helpful, but in a smug, superior sort of way?",Patronizing,Beth Lincoln,A Dictionary of Scoundrels,OBOB Parent Group
a-dictionary-of-scoundrels,content,85,What does Shenanigan use as a magnifying glass?,Her grandmother’s old monocle,Beth Lincoln,A Dictionary of Scoundrels,OBOB Parent Group
a-dictionary-of-scoundrels,content,101,What is the name of the private detective?,Gumshoe Swift,Beth Lincoln,A Dictionary of Scoundrels,OBOB Parent Group
a-dictionary-of-scoundrels,content,101,what is the first and last name of the private detective?,Gumshoe Swift,Beth Lincoln,A Dictionary of Scoundrels,OBOB Parent Group
a-dictionary-of-scoundrels,content,102,What gift does Shenanigan receive from Erf?,A notebook with secret sketches,Beth Lincoln,A Dictionary of Scoundrels,OBOB Parent Group
a-dictionary-of-scoundrels,content,104,what time do people in the dining room hear a crash? Be specific.,20:53:00,Beth Lincoln,A Dictionary of Scoundrels,OBOB Parent Group
a-dictionary-of-scoundrels,content,110,What sign reads “NO ENTRY” with bold letters?,Door to the secret attic,Beth Lincoln,A Dictionary of Scoundrels,OBOB Parent Group
a-dictionary-of-scoundrels,content,122,What food does Flora hate eating?,peas,Beth Lincoln,A Dictionary of Scoundrels,OBOB Parent Group
a-dictionary-of-scoundrels,content,127,"what term means ""a morbid fear of dinner parties""?",Deipnophobia,Beth Lincoln,A Dictionary of Scoundrels,OBOB Parent Group
a-dictionary-of-scoundrels,content,130,What strange sound echoes through the night?,Whispering in the halls,Beth Lincoln,A Dictionary of Scoundrels,OBOB Parent Group
a-dictionary-of-scoundrels,content,132,"according to Gumshoe, what is the first name of the person with the ""face of an angel""?",Atrocious,Beth Lincoln,A Dictionary of Scoundrels,OBOB Parent Group
a-dictionary-of-scoundrels,content,138,Which hall features family portraits with eyes that seem to follow you?,Gallery of Ancestors,Beth Lincoln,A Dictionary of Scoundrels,OBOB Parent Group
a-dictionary-of-scoundrels,content,149,"Which sister had nails cut short, not chewed",Fauna,Beth Lincoln,A Dictionary of Scoundrels,OBOB Parent Group
a-dictionary-of-scoundrels,content,149,what is the name of the restaurant Maelstrom was executive chef at when he was younger?,Drunken Noodle,Beth Lincoln,A Dictionary of Scoundrels,OBOB Parent Group
a-dictionary-of-scoundrels,content,168,what is the name of the principle that means the simpleset solution is usually right?,Occam's Razor,Beth Lincoln,A Dictionary of Scoundrels,OBOB Parent Group
a-dictionary-of-scoundrels,content,180,how many letters do the Swifts start with in a game of Scrabble?,Fourteen,Beth Lincoln,A Dictionary of Scoundrels,OBOB Parent Group
a-dictionary-of-scoundrels,content,210,What clue leads to the hidden basement door?,A missing floorboard in the study,Beth Lincoln,A Dictionary of Scoundrels,OBOB Parent Group
a-dictionary-of-scoundrels,content,270,Which room becomes the main setting for the investigation climax?,The Secret Vault room.,Beth Lincoln,A Dictionary of Scoundrels,OBOB Parent Group
a-dictionary-of-scoundrels,content,295,What secret message does Shenanigan slip into the Family Dictionary?,“May the best scoundrel win.”,Beth Lincoln,A Dictionary of Scoundrels,OBOB Parent Group
a-dictionary-of-scoundrels,content,,who did Cook bring a tray of food at roughly 7:30pm beacuse they missed dinner?,Daisy,Beth Lincoln,A Dictionary of Scoundrels,OBOB Parent Group
a-dictionary-of-scoundrels,content,29,what household feature is disguised by the painting of the Nun Picking Her Nose?,Laundry Chute,Beth Lincoln,A Dictionary of Scoundrels,Lake Oswego Public Library
a-dictionary-of-scoundrels,content,30,what is the name of the fruit that makes Shenanigan’s hands sticky when she finds the secret room?,Apple,Beth Lincoln,A Dictionary of Scoundrels,Lake Oswego Public Library
a-dictionary-of-scoundrels,content,30,what types of books are the safest in the library?,Detective novels,Beth Lincoln,A Dictionary of Scoundrels,Lake Oswego Public Library
a-dictionary-of-scoundrels,content,144,what is the first name of the character whose motive for murder could be to “not eat [their] peas?”,Flora,Beth Lincoln,A Dictionary of Scoundrels,Lake Oswego Public Library
a-dictionary-of-scoundrels,content,147,how many times does Thespian forget his lines?,Five,Beth Lincoln,A Dictionary of Scoundrels,Lake Oswego Public Library
a-dictionary-of-scoundrels,content,157,what is the title of the book Shenanagin reads under the table?,The Tragical Tale of Gramercy and Vile,Beth Lincoln,A Dictionary of Scoundrels,Lake Oswego Public Library
a-dictionary-of-scoundrels,content,162,what is the name of the vegetable that Candor always finds something to be “off” about?,Parsnips,Beth Lincoln,A Dictionary of Scoundrels,Lake Oswego Public Library
a-dictionary-of-scoundrels,content,165,what is the first and last name of the author of the book in Gumshoe’s hand when he is found?,Agatha Christie,Beth Lincoln,A Dictionary of Scoundrels,Lake Oswego Public Library
a-dictionary-of-scoundrels,content,174,what color are John the Cat’s eyes?,Green,Beth Lincoln,A Dictionary of Scoundrels,Lake Oswego Public Library
a-dictionary-of-scoundrels,content,184,what is the final word played in the game of scrabble?,Absquatulate,Beth Lincoln,A Dictionary of Scoundrels,Lake Oswego Public Library
a-dictionary-of-scoundrels,content,196,what two words are on the little slip of paper wrapped around the arrow that was shot at Pamplemousse?,Au Revoir,Beth Lincoln,A Dictionary of Scoundrels,OBOB Parent Group
a-dictionary-of-scoundrels,content,208,what is the first name of the referee for the MockUp?,Fauna,Beth Lincoln,A Dictionary of Scoundrels,Lake Oswego Public Library
a-dictionary-of-scoundrels,content,209,[Two Part Question] what are the first names of the two characters chosen to play first in the Mock-Up?,Tintinnabula AND Covetous,Beth Lincoln,A Dictionary of Scoundrels,OBOB Parent Group
a-dictionary-of-scoundrels,content,209,what are the first names of the first two Swifts called for the Mock-Up?,Tintinnabula and Covetous,Beth Lincoln,A Dictionary of Scoundrels,Lake Oswego Public Library
a-dictionary-of-scoundrels,content,227,what is the four-word name for the machine used for talking to the dead?,Ecto Electric Kin Communicator,Beth Lincoln,A Dictionary of Scoundrels,OBOB Parent Group
a-dictionary-of-scoundrels,content,228,what year was the Ecto Electric Kin Communicator made?,1888,Beth Lincoln,A Dictionary of Scoundrels,OBOB Parent Group
a-dictionary-of-scoundrels,content,228,what type of dead animal blocks the gears of the EEK?,Mouse,Beth Lincoln,A Dictionary of Scoundrels,Lake Oswego Public Library
a-dictionary-of-scoundrels,content,262,what is Cook's real first name?,Winifred,Beth Lincoln,A Dictionary of Scoundrels,OBOB Parent Group
a-dictionary-of-scoundrels,content,262,how long has cook lived in the Swift house?,20 Years,Beth Lincoln,A Dictionary of Scoundrels,OBOB Parent Group
a-dictionary-of-scoundrels,content,263,what Olympic sport does Cook prefer over archery?,Shot put,Beth Lincoln,A Dictionary of Scoundrels,Lake Oswego Public Library
a-dictionary-of-scoundrels,content,266,what color are Candor’s surgical gloves?,White,Beth Lincoln,A Dictionary of Scoundrels,Lake Oswego Public Library
a-dictionary-of-scoundrels,content,278,"what term means ""a terrible fear of water""?",Hydrophobia,Beth Lincoln,A Dictionary of Scoundrels,OBOB Parent Group
a-dictionary-of-scoundrels,content,294,[Two Part Question] What two things does Aunt Schadenfruede smell like?,Lillies AND Boot Polish,Beth Lincoln,A Dictionary of Scoundrels,OBOB Parent Group
a-dictionary-of-scoundrels,content,298,how long could Harry Houdini hold his breath for?,3 Minutes,Beth Lincoln,A Dictionary of Scoundrels,OBOB Parent Group
a-dictionary-of-scoundrels,content,313,what did the family bury instead of Aunt Schadenfruede?,Suit of Armor,Beth Lincoln,A Dictionary of Scoundrels,OBOB Parent Group
a-dictionary-of-scoundrels,content,320,Which character is revealed to be behind the attacks?,Candour,Beth Lincoln,A Dictionary of Scoundrels,OBOB Parent Group
a-dictionary-of-scoundrels,content,336,Who is revealed to be behind the hidden treasure clues?,Cantrip Randrup-Swift,Beth Lincoln,A Dictionary of Scoundrels,OBOB Parent Group
a-dictionary-of-scoundrels,in-which-book,3,does a girl named Shenanigan feel her destiny is mischief?,,Beth Lincoln,A Dictionary of Scoundrels,OBOB Parent Group
a-dictionary-of-scoundrels,in-which-book,4,do characters wind between graves like black floss through crooked teeth?,,Beth Lincoln,A Dictionary of Scoundrels,OBOB Parent Group
a-dictionary-of-scoundrels,in-which-book,5,does a Naming Ceremony define children with words?,,Beth Lincoln,A Dictionary of Scoundrels,OBOB Parent Group
a-dictionary-of-scoundrels,in-which-book,7,does someone attempt to smear icing into someone's beard?,,Beth Lincoln,A Dictionary of Scoundrels,OBOB Parent Group
a-dictionary-of-scoundrels,in-which-book,8,"does a character shrug and say ""cats like boxes""?",,Beth Lincoln,A Dictionary of Scoundrels,OBOB Parent Group
a-dictionary-of-scoundrels,in-which-book,9,does a character keep a pack ready on the roof?,,Beth Lincoln,A Dictionary of Scoundrels,OBOB Parent Group
a-dictionary-of-scoundrels,in-which-book,11,is there a local postie named Suleiman?,,Beth Lincoln,A Dictionary of Scoundrels,OBOB Parent Group
a-dictionary-of-scoundrels,in-which-book,13,does sibling Felicity insist on propriety?,,Beth Lincoln,A Dictionary of Scoundrels,OBOB Parent Group
a-dictionary-of-scoundrels,in-which-book,16,does someone order caterpillars from an ad in the back of a wildlife magazine?,,Beth Lincoln,A Dictionary of Scoundrels,OBOB Parent Group
a-dictionary-of-scoundrels,in-which-book,18,do siblings compete for a hidden inheritance?,,Beth Lincoln,A Dictionary of Scoundrels,OBOB Parent Group
a-dictionary-of-scoundrels,in-which-book,18,"is a book described as ""just a normal book--a bit too big to read in the bath, but a book all the same""?",,Beth Lincoln,A Dictionary of Scoundrels,OBOB Parent Group
a-dictionary-of-scoundrels,in-which-book,20,do siblings form alliances in the game of heirs?,,Beth Lincoln,A Dictionary of Scoundrels,OBOB Parent Group
a-dictionary-of-scoundrels,in-which-book,23,is a pantry counted wrong and creates suspicion?,,Beth Lincoln,A Dictionary of Scoundrels,OBOB Parent Group
a-dictionary-of-scoundrels,in-which-book,24,"are two brothers described like ""chalk and cheese""",,Beth Lincoln,A Dictionary of Scoundrels,OBOB Parent Group
a-dictionary-of-scoundrels,in-which-book,24,was someone found dead in the garden with an axe in their back?,,Beth Lincoln,A Dictionary of Scoundrels,OBOB Parent Group
a-dictionary-of-scoundrels,in-which-book,25,does a character build a monument to himself in the garden?,,Beth Lincoln,A Dictionary of Scoundrels,OBOB Parent Group
a-dictionary-of-scoundrels,in-which-book,28,does a cousin named Erf choose their own name?,,Beth Lincoln,A Dictionary of Scoundrels,OBOB Parent Group
a-dictionary-of-scoundrels,in-which-book,29,does a character find moldy remains of a sandwich?,,Beth Lincoln,A Dictionary of Scoundrels,OBOB Parent Group
a-dictionary-of-scoundrels,in-which-book,30,does someone always carry a Swiss Army Knife with them?,,Beth Lincoln,A Dictionary of Scoundrels,OBOB Parent Group
a-dictionary-of-scoundrels,in-which-book,36,does a character have a red motorbike with a sidecar?,,Beth Lincoln,A Dictionary of Scoundrels,OBOB Parent Group
a-dictionary-of-scoundrels,in-which-book,36,does a character ride a red motorbike to do errands and bring back supplies?,,Beth Lincoln,A Dictionary of Scoundrels,Lake Oswego Public Library
a-dictionary-of-scoundrels,in-which-book,42,is Aunt Schadenfreude pushed down a grand staircase?,,Beth Lincoln,A Dictionary of Scoundrels,OBOB Parent Group
a-dictionary-of-scoundrels,in-which-book,44,does someone sleep in a straight-backed red velvet armchair instead of a bed?,,Beth Lincoln,A Dictionary of Scoundrels,OBOB Parent Group
a-dictionary-of-scoundrels,in-which-book,49,is someone told not to be a wet sandwich?,,Beth Lincoln,A Dictionary of Scoundrels,Lake Oswego Public Library
a-dictionary-of-scoundrels,in-which-book,54,does a character communicate using morse code?,,Beth Lincoln,A Dictionary of Scoundrels,OBOB Parent Group
a-dictionary-of-scoundrels,in-which-book,58,is someone munching on a bag of coffee beans?,,Beth Lincoln,A Dictionary of Scoundrels,OBOB Parent Group
a-dictionary-of-scoundrels,in-which-book,59,"does a character give the following advice ""Keep your head down, trust no one, and don't play any games you don't know the rules to""?",,Beth Lincoln,A Dictionary of Scoundrels,OBOB Parent Group
a-dictionary-of-scoundrels,in-which-book,60,does a vase break and starts a family feud?,,Beth Lincoln,A Dictionary of Scoundrels,OBOB Parent Group
a-dictionary-of-scoundrels,in-which-book,61,does Shenanigan pocket a key after breaking a vase?,,Beth Lincoln,A Dictionary of Scoundrels,OBOB Parent Group
a-dictionary-of-scoundrels,in-which-book,61,is the discovery of a hidden basement door key pivotal?,,Beth Lincoln,A Dictionary of Scoundrels,OBOB Parent Group
a-dictionary-of-scoundrels,in-which-book,65,is there a coffee bean floating in the fruit punch?,,Beth Lincoln,A Dictionary of Scoundrels,OBOB Parent Group
a-dictionary-of-scoundrels,in-which-book,65,are chewed-up coffee beans floating in the fruit punch?,,Beth Lincoln,A Dictionary of Scoundrels,Lake Oswego Public Library
a-dictionary-of-scoundrels,in-which-book,67,is a character good at smuggling spiders in their sleeves?,,Beth Lincoln,A Dictionary of Scoundrels,OBOB Parent Group
a-dictionary-of-scoundrels,in-which-book,73,is drilling not permitted in a house after 9pm?,,Beth Lincoln,A Dictionary of Scoundrels,OBOB Parent Group
a-dictionary-of-scoundrels,in-which-book,85,does a magnifying glass lead to a hidden note?,,Beth Lincoln,A Dictionary of Scoundrels,OBOB Parent Group
a-dictionary-of-scoundrels,in-which-book,85,does Shenanigan use a monocle to solve a clue?,,Beth Lincoln,A Dictionary of Scoundrels,OBOB Parent Group
a-dictionary-of-scoundrels,in-which-book,90,is great-uncle’s letter about a tunnel found?,,Beth Lincoln,A Dictionary of Scoundrels,OBOB Parent Group
a-dictionary-of-scoundrels,in-which-book,96,"do characters play a game called ""Postmortem""?",,Beth Lincoln,A Dictionary of Scoundrels,OBOB Parent Group
a-dictionary-of-scoundrels,in-which-book,100,are guests downstairs enjoying coffee and a nightcap?,,Beth Lincoln,A Dictionary of Scoundrels,OBOB Parent Group
a-dictionary-of-scoundrels,in-which-book,104,"is a characters area of expertise dates, details, and durations?",,Beth Lincoln,A Dictionary of Scoundrels,OBOB Parent Group
a-dictionary-of-scoundrels,in-which-book,111,is a character fascinated with globes?,,Beth Lincoln,A Dictionary of Scoundrels,OBOB Parent Group
a-dictionary-of-scoundrels,in-which-book,112,does Shenanigan discover a toy dragon in the attic?,,Beth Lincoln,A Dictionary of Scoundrels,OBOB Parent Group
a-dictionary-of-scoundrels,in-which-book,120,does Aunt Prudence notice muddy footprints?,,Beth Lincoln,A Dictionary of Scoundrels,OBOB Parent Group
a-dictionary-of-scoundrels,in-which-book,121,does a character have a grudge against someone because they made them eat peas?,,Beth Lincoln,A Dictionary of Scoundrels,OBOB Parent Group
a-dictionary-of-scoundrels,in-which-book,123,are the steering wheels stolen from all of the cars?,,Beth Lincoln,A Dictionary of Scoundrels,OBOB Parent Group
a-dictionary-of-scoundrels,in-which-book,123,is someone's steering wheel stolen from their brother's car?,,Beth Lincoln,A Dictionary of Scoundrels,OBOB Parent Group
a-dictionary-of-scoundrels,in-which-book,138,do ancestral portraits seem to watch you?,,Beth Lincoln,A Dictionary of Scoundrels,OBOB Parent Group
a-dictionary-of-scoundrels,in-which-book,140,does a mysterious portrait spark curiosity?,,Beth Lincoln,A Dictionary of Scoundrels,OBOB Parent Group
a-dictionary-of-scoundrels,in-which-book,143,is trust described as given in small measurements such as teacups and eggcups?,,Beth Lincoln,A Dictionary of Scoundrels,Lake Oswego Public Library
a-dictionary-of-scoundrels,in-which-book,146,does someone twist a candlestick into the shape of a pretzel?,,Beth Lincoln,A Dictionary of Scoundrels,OBOB Parent Group
a-dictionary-of-scoundrels,in-which-book,146,does someone twist an iron candlestick into a pretzel?,,Beth Lincoln,A Dictionary of Scoundrels,Lake Oswego Public Library
a-dictionary-of-scoundrels,in-which-book,150,is a secret room called the Panic Chamber?,,Beth Lincoln,A Dictionary of Scoundrels,OBOB Parent Group
a-dictionary-of-scoundrels,in-which-book,150,is a panic alarm hidden in the walls?,,Beth Lincoln,A Dictionary of Scoundrels,OBOB Parent Group
a-dictionary-of-scoundrels,in-which-book,152,do ice crystals begin to form on someone's beard?,,Beth Lincoln,A Dictionary of Scoundrels,OBOB Parent Group
a-dictionary-of-scoundrels,in-which-book,152,does someone not know how to cook anything but seagull?,,Beth Lincoln,A Dictionary of Scoundrels,Lake Oswego Public Library
a-dictionary-of-scoundrels,in-which-book,153,does a soup resemble a swamp?,,Beth Lincoln,A Dictionary of Scoundrels,Lake Oswego Public Library
a-dictionary-of-scoundrels,in-which-book,175,does someone consider turning on a Bunsen burner and setting fire to their hair?,,Beth Lincoln,A Dictionary of Scoundrels,OBOB Parent Group
a-dictionary-of-scoundrels,in-which-book,178,does the sun rise bloody at five in the morning?,,Beth Lincoln,A Dictionary of Scoundrels,Lake Oswego Public Library
a-dictionary-of-scoundrels,in-which-book,179,do the characters play on a Scrabble game this size of a tennsi court?,,Beth Lincoln,A Dictionary of Scoundrels,OBOB Parent Group
a-dictionary-of-scoundrels,in-which-book,182,does a secret society wear purple capes?,,Beth Lincoln,A Dictionary of Scoundrels,OBOB Parent Group
a-dictionary-of-scoundrels,in-which-book,208,do characters participate in an insult contest?,,Beth Lincoln,A Dictionary of Scoundrels,OBOB Parent Group
a-dictionary-of-scoundrels,in-which-book,209,is a character called a puttock?,,Beth Lincoln,A Dictionary of Scoundrels,Lake Oswego Public Library
a-dictionary-of-scoundrels,in-which-book,210,does a basement door open with a hidden key?,,Beth Lincoln,A Dictionary of Scoundrels,OBOB Parent Group
a-dictionary-of-scoundrels,in-which-book,210,"is someone told they are a bitter, dried-up lemon rind?",,Beth Lincoln,A Dictionary of Scoundrels,OBOB Parent Group
a-dictionary-of-scoundrels,in-which-book,219,does a character give a blank wall a series of complicated knocks and taps?,,Beth Lincoln,A Dictionary of Scoundrels,OBOB Parent Group
a-dictionary-of-scoundrels,in-which-book,229,"does a character say, “I can’t believe you didn’t notice the skeleton?”",,Beth Lincoln,A Dictionary of Scoundrels,Lake Oswego Public Library
a-dictionary-of-scoundrels,in-which-book,247,does someone brush imaginary dust of their knees?,,Beth Lincoln,A Dictionary of Scoundrels,OBOB Parent Group
a-dictionary-of-scoundrels,in-which-book,252,is there a microscope said to be capable of surviving a hurricane?,,Beth Lincoln,A Dictionary of Scoundrels,Lake Oswego Public Library
a-dictionary-of-scoundrels,in-which-book,261,is someone offered a slice of Madeira cake?,,Beth Lincoln,A Dictionary of Scoundrels,OBOB Parent Group
