book_key,question_type,page,text,answer,author_name,book_title,source_name
mexikid-a-graphic-memoir,content,1,What is Peter's real name?,Pedro,Pedro Martin,Mexikid: A Graphic Memoir,OBOB Parent Group
mexikid-a-graphic-memoir,content,1,How many kids are in the Martin family?,9,Pedro Martin,Mexikid: A Graphic Memoir,OBOB Parent Group
mexikid-a-graphic-memoir,content,3,whose Mexican and American names are pronounced the same?,Leon,Pedro Martin,Mexikid: A Graphic Memoir,OBOB Parent Group
mexikid-a-graphic-memoir,content,5,What year does the memoir begin?,1977,Pedro Martin,Mexikid: A Graphic Memoir,OBOB Parent Group
mexikid-a-graphic-memoir,content,10,What is Pedro's favorite show?,Happy Days,Pedro Martin,Mexikid: A Graphic Memoir,OBOB Parent Group
mexikid-a-graphic-memoir,content,11,Where does the Martin family live?,California,Pedro Martin,Mexikid: A Graphic Memoir,OBOB Parent Group
mexikid-a-graphic-memoir,content,11,What historical event did Abuelito live through?,Mexican Revolution,Pedro Martin,Mexikid: A Graphic Memoir,OBOB Parent Group
mexikid-a-graphic-memoir,content,,How does Pedro's father gather all the kids when it's time to leave the store?,He whistles,Pedro Martin,Mexikid: A Graphic Memoir,OBOB Parent Group
mexikid-a-graphic-memoir,content,25,What action figure does Pedro buy at Kmart?,Green Arrow,Pedro Martin,Mexikid: A Graphic Memoir,OBOB Parent Group
mexikid-a-graphic-memoir,content,25,What toy collection does Pedro cherish?,His action figures,Pedro Martin,Mexikid: A Graphic Memoir,OBOB Parent Group
mexikid-a-graphic-memoir,content,36,How many of Pedro's siblings were born in Mexico?,Five,Pedro Martin,Mexikid: A Graphic Memoir,OBOB Parent Group
mexikid-a-graphic-memoir,content,44,What did Apa install in the two vehicles so they could talk to one another instantly?,CB radios,Pedro Martin,Mexikid: A Graphic Memoir,OBOB Parent Group
mexikid-a-graphic-memoir,content,48,"what is a made-up word the main character used to describe motorhomes, which are like giant apartment-sized pinball machines?",Fungerous,Pedro Martin,Mexikid: A Graphic Memoir,OBOB Parent Group
mexikid-a-graphic-memoir,content,50,What fruit did Ama have stashed all around the RV?,Bananas,Pedro Martin,Mexikid: A Graphic Memoir,OBOB Parent Group
mexikid-a-graphic-memoir,content,63,What breakfast does the family share with friends after they stay the night in Los Angeles?,Chilaquiles,Pedro Martin,Mexikid: A Graphic Memoir,OBOB Parent Group
mexikid-a-graphic-memoir,content,72,"How much do the guards at the border want as a ""fee""?",200,Pedro Martin,Mexikid: A Graphic Memoir,OBOB Parent Group
mexikid-a-graphic-memoir,content,91,What does the drink Pedro buys in Mexico contain that he can't drink?,Raw milk,Pedro Martin,Mexikid: A Graphic Memoir,OBOB Parent Group
mexikid-a-graphic-memoir,content,104,What was on Apa's menu in the restaurant in Mexico?,A cockroach,Pedro Martin,Mexikid: A Graphic Memoir,OBOB Parent Group
mexikid-a-graphic-memoir,content,108,Why is Pedro upset when he goes to read the comic books he got at the Marcado?,They are written in Spanish,Pedro Martin,Mexikid: A Graphic Memoir,OBOB Parent Group
mexikid-a-graphic-memoir,content,109,What does Pedro make about Abuelito's life?,A comic book,Pedro Martin,Mexikid: A Graphic Memoir,OBOB Parent Group
mexikid-a-graphic-memoir,content,112,Where does the family travel to in the book?,"Pegueros, Mexico",Pedro Martin,Mexikid: A Graphic Memoir,OBOB Parent Group
mexikid-a-graphic-memoir,content,112,What is across the street from Pedro's house in Mexico?,A big church,Pedro Martin,Mexikid: A Graphic Memoir,OBOB Parent Group
mexikid-a-graphic-memoir,content,113,Who is the first kid Pedro sees when he visits Pegueros?,Simon,Pedro Martin,Mexikid: A Graphic Memoir,OBOB Parent Group
mexikid-a-graphic-memoir,content,,What color is the scarf around the barber's neck?,red,Pedro Martin,Mexikid: A Graphic Memoir,OBOB Parent Group
mexikid-a-graphic-memoir,content,4,what movie did Sal take Pedro to see?,Star Wars,Pedro Martin,Mexikid: A Graphic Memoir,OBOB Parent Group
mexikid-a-graphic-memoir,content,63,[Two Part] name 2 ingredients of a famous Mexican breakfast dish that uses leftovers from the party the night before.,"(any two): Fried eggs, Frijoles, chips, salsa, onion, queso, avocado",Pedro Martin,Mexikid: A Graphic Memoir,OBOB Parent Group
mexikid-a-graphic-memoir,content,65,which place does Peter think is the greatest roadside attraction on Earth?,Disneyland,Pedro Martin,Mexikid: A Graphic Memoir,OBOB Parent Group
mexikid-a-graphic-memoir,content,73,"what is the name that Apa uses for the “Mexican Jedi Mind Trick”, in which he pretends to know the guard at the Mexican border?",Jose Luis,Pedro Martin,Mexikid: A Graphic Memoir,OBOB Parent Group
mexikid-a-graphic-memoir,content,89,what substance generates incredible heat when you spit on a piece of tinfoil and scrape off bits of the horn into it?,Quicklime or Calcium Oxide,Pedro Martin,Mexikid: A Graphic Memoir,OBOB Parent Group
mexikid-a-graphic-memoir,content,90,what color is the licuado that Pedro buys?,Banana yellow (yellow accepted),Pedro Martin,Mexikid: A Graphic Memoir,OBOB Parent Group
mexikid-a-graphic-memoir,content,90,what flavor of jelly is in Pedro’s Licuado?,Strawberry,Pedro Martin,Mexikid: A Graphic Memoir,OBOB Parent Group
mexikid-a-graphic-memoir,content,99,[Two Part] why does the helpful ghost in Pedro’s house in Mexico not tell them exactly where he hid his gambling treasure?,Tax purposes and not remembering exactly where,Pedro Martin,Mexikid: A Graphic Memoir,OBOB Parent Group
mexikid-a-graphic-memoir,content,124,where was Abuelito traveling from while suffering a bloody head injury?,Tepatitlan,Pedro Martin,Mexikid: A Graphic Memoir,OBOB Parent Group
mexikid-a-graphic-memoir,content,130,[Two Part] what is Abuelito’s first and last name?,Don and Alejandro,Pedro Martin,Mexikid: A Graphic Memoir,OBOB Parent Group
mexikid-a-graphic-memoir,content,145,where does Luis live?,Michoacan,Pedro Martin,Mexikid: A Graphic Memoir,OBOB Parent Group
mexikid-a-graphic-memoir,content,156,What is the name of the girl Pedro wants to buy candy for?,Margarita,Pedro Martin,Mexikid: A Graphic Memoir,OBOB Parent Group
mexikid-a-graphic-memoir,content,157,What does Pedro buy instead of candy to impress the girl?,A pig shaped cookie,Pedro Martin,Mexikid: A Graphic Memoir,OBOB Parent Group
mexikid-a-graphic-memoir,content,170,What type of candy did Pedro and his brother want to buy when they were in Tepatitlan?,Pop Rocks,Pedro Martin,Mexikid: A Graphic Memoir,OBOB Parent Group
mexikid-a-graphic-memoir,content,177,What did Apa buy when they went to Tepatitlan?,A small coffin,Pedro Martin,Mexikid: A Graphic Memoir,OBOB Parent Group
mexikid-a-graphic-memoir,content,179,What two things must happen before Abuelito will go to the states?,Abuelita must be safe and his animals need good homes,Pedro Martin,Mexikid: A Graphic Memoir,OBOB Parent Group
mexikid-a-graphic-memoir,content,180,what was Abuelita’s favorite flavor of ice cream?,Strawberry,Pedro Martin,Mexikid: A Graphic Memoir,OBOB Parent Group
mexikid-a-graphic-memoir,content,188,How many coffins were on top of abuelita's coffin?,Two,Pedro Martin,Mexikid: A Graphic Memoir,OBOB Parent Group
mexikid-a-graphic-memoir,content,192,How old was Pedro's Apa when he left home to work at the cotton fields?,16,Pedro Martin,Mexikid: A Graphic Memoir,OBOB Parent Group
mexikid-a-graphic-memoir,content,197,why does Adam leave the graveyard?,Because he felt sick or hot or something,Pedro Martin,Mexikid: A Graphic Memoir,OBOB Parent Group
mexikid-a-graphic-memoir,content,204,What does Pedro share with his brother when he says he got dizzy because of the sun?,A soda,Pedro Martin,Mexikid: A Graphic Memoir,OBOB Parent Group
mexikid-a-graphic-memoir,content,205,What does Pedro bring to his aunt's house after they moved Abuelita into the new mausoleum?,Bananas,Pedro Martin,Mexikid: A Graphic Memoir,OBOB Parent Group
mexikid-a-graphic-memoir,content,215,"When they go to say their final goodbyes to Abuelita, what do they put on the tomb?",rocks and flowers,Pedro Martin,Mexikid: A Graphic Memoir,OBOB Parent Group
mexikid-a-graphic-memoir,content,223,In what Mexican city does the family stop to eat lobster and play in the ocean?,Puerto Vallarta,Pedro Martin,Mexikid: A Graphic Memoir,OBOB Parent Group
mexikid-a-graphic-memoir,content,247,What does Abuelito warn Pedro is in the desert?,Snakes and scorpions,Pedro Martin,Mexikid: A Graphic Memoir,OBOB Parent Group
mexikid-a-graphic-memoir,content,253,what must you do once you kill an animal?,Eat it,Pedro Martin,Mexikid: A Graphic Memoir,OBOB Parent Group
mexikid-a-graphic-memoir,content,255,What does Apa say he would have to teach Pedro in order to teach him the Jedi Mind Trick?,How to bribe guards,Pedro Martin,Mexikid: A Graphic Memoir,OBOB Parent Group
mexikid-a-graphic-memoir,content,258,What city does the Martin family live in?,Watsonville,Pedro Martin,Mexikid: A Graphic Memoir,OBOB Parent Group
mexikid-a-graphic-memoir,content,258,[Two Part] What will Abuelito miss most about Mexico?,His cows and mule,Pedro Martin,Mexikid: A Graphic Memoir,OBOB Parent Group
mexikid-a-graphic-memoir,content,269,What does Abuelito lift that impresses Pedro?,A deer,Pedro Martin,Mexikid: A Graphic Memoir,OBOB Parent Group
mexikid-a-graphic-memoir,content,271,"Where do they stash the ""dead"" dear after picking it up from the side of the road?",Bathroom/shower stall,Pedro Martin,Mexikid: A Graphic Memoir,OBOB Parent Group
mexikid-a-graphic-memoir,content,294,What did the older children use to fill the truck battery up with water?,The little peepee man,Pedro Martin,Mexikid: A Graphic Memoir,OBOB Parent Group
mexikid-a-graphic-memoir,content,306,What special yell does Pedro discover he can finally do at the end of the book?,Grito,Pedro Martin,Mexikid: A Graphic Memoir,OBOB Parent Group
mexikid-a-graphic-memoir,content,,[Two Part] what does Apa buy for the kids from the mechanic? Name two products. BE SPECIFIC!,"Red, yellow, and orange sodas, as well as snacks (fanta is accepted as an answer)",Pedro Martin,Mexikid: A Graphic Memoir,OBOB Parent Group
mexikid-a-graphic-memoir,content,1,how many siblings does Pedro have?,Eight,Pedro Martin,Mexikid: A Graphic Memoir,Lake Oswego Public Library
mexikid-a-graphic-memoir,content,13,which of Pedro’s relatives in Mexico is coming to live with the Martin family?,His grandfather,Pedro Martin,Mexikid: A Graphic Memoir,Lake Oswego Public Library
mexikid-a-graphic-memoir,content,23,which store does the Martin family go to in order to prepare for traveling?,Kmart,Pedro Martin,Mexikid: A Graphic Memoir,Lake Oswego Public Library
mexikid-a-graphic-memoir,content,30,name one of the four characters or people that Pedro’s mom mistakes for Superman?,"Spiderman, Popeye, Rocky, and Liberace",Pedro Martin,Mexikid: A Graphic Memoir,Lake Oswego Public Library
mexikid-a-graphic-memoir,content,44,what is Pedro’s father’s nickname when he used the CB radio?,Chato,Pedro Martin,Mexikid: A Graphic Memoir,Lake Oswego Public Library
mexikid-a-graphic-memoir,content,72,What do the guards at Mexican border threaten Ama and Apa with if they don’t pay $200?,The guards will confiscate their items.,Pedro Martin,Mexikid: A Graphic Memoir,OBOB Parent Group
mexikid-a-graphic-memoir,content,73,what is the name of the trick that Apa uses to pretend that he knows one of the guards at the border?,Mexican Jedi Mind Trick,Pedro Martin,Mexikid: A Graphic Memoir,OBOB Parent Group
mexikid-a-graphic-memoir,content,80,what does Pedro’s brother tell him that Tijuana means in English?,Doll Town,Pedro Martin,Mexikid: A Graphic Memoir,Lake Oswego Public Library
mexikid-a-graphic-memoir,content,105,what kind of animal was on the menu at a restaurant in a small Mexican town?,Cockroach,Pedro Martin,Mexikid: A Graphic Memoir,OBOB Parent Group
mexikid-a-graphic-memoir,content,105,what does Pedro’s dad find in his restaurant menu?,A cockroach,Pedro Martin,Mexikid: A Graphic Memoir,Lake Oswego Public Library
mexikid-a-graphic-memoir,content,108,what does Lila do when she needs a break from all of Sal’s tunes?,Ride in a motorhome or ride with little kids or ride with her parents.,Pedro Martin,Mexikid: A Graphic Memoir,OBOB Parent Group
mexikid-a-graphic-memoir,content,112,"what is across the street from Ama’s and Apa’s house in their hometown, Pegueros?",the big church.,Pedro Martin,Mexikid: A Graphic Memoir,OBOB Parent Group
mexikid-a-graphic-memoir,content,112,"what do Ama and Apa do with their house in their hometown, Pegueros, when the family is away?",Rent it out,Pedro Martin,Mexikid: A Graphic Memoir,OBOB Parent Group
mexikid-a-graphic-memoir,content,122,"During the time of Cristeros Rebellion, where do the priests celebrate mass?",In the cave or underground,Pedro Martin,Mexikid: A Graphic Memoir,OBOB Parent Group
mexikid-a-graphic-memoir,content,130,how did Pedro’s grandfather get a head injury in the story told by the barber?,His mule kicked him when it heard gunfire,Pedro Martin,Mexikid: A Graphic Memoir,Lake Oswego Public Library
mexikid-a-graphic-memoir,content,135,what liquid does the barber use to clean his razor during Pedro’s haircut?,Tequila,Pedro Martin,Mexikid: A Graphic Memoir,Lake Oswego Public Library
mexikid-a-graphic-memoir,content,151,Pedro learns that his dad’s whistle that he uses to call his children in Kmart is actually his grandfather’s whistle to call what kind of animal?,Mules (or pigs),Pedro Martin,Mexikid: A Graphic Memoir,Lake Oswego Public Library
mexikid-a-graphic-memoir,content,158,Pedro buys a pig shaped cookie to impress whom?,Margarita,Pedro Martin,Mexikid: A Graphic Memoir,Lake Oswego Public Library
mexikid-a-graphic-memoir,content,171,"from Pedro’s perspective, what is the best kind of candy ever invented?",Pop Rocks,Pedro Martin,Mexikid: A Graphic Memoir,OBOB Parent Group
mexikid-a-graphic-memoir,content,172,what candy does Pedro and his brothers buy from the tiendito?,Pop Rocks,Pedro Martin,Mexikid: A Graphic Memoir,Lake Oswego Public Library
mexikid-a-graphic-memoir,content,191,What job do the airplane leaflets say is hiring?,Jobs in the cotton field,Pedro Martin,Mexikid: A Graphic Memoir,OBOB Parent Group
mexikid-a-graphic-memoir,content,201,what color velvet ribbon was Pedro’s grandmother buried with?,Purple,Pedro Martin,Mexikid: A Graphic Memoir,Lake Oswego Public Library
mexikid-a-graphic-memoir,content,210,"what’s the Spanish word for a yell of great emotional feeling, which Pedro is not sure he’s “Mexican enough” to do?",Grito,Pedro Martin,Mexikid: A Graphic Memoir,Lake Oswego Public Library
mexikid-a-graphic-memoir,content,260,what food item does Pedro’s mother use to make a metaphor about his grandfather’s mixed feelings about leaving Mexico?,An avocado,Pedro Martin,Mexikid: A Graphic Memoir,Lake Oswego Public Library
mexikid-a-graphic-memoir,content,297,what Mexican dish do the Martins’ make to celebrate the arrival of Pedro’s abuelito?,Birria,Pedro Martin,Mexikid: A Graphic Memoir,Lake Oswego Public Library
mexikid-a-graphic-memoir,in-which-book,5,does a family of 11 live in a house made for a family of 5?,,Pedro Martin,Mexikid: A Graphic Memoir,OBOB Parent Group
mexikid-a-graphic-memoir,in-which-book,9,does the main character say TV is comparable to God?,,Pedro Martin,Mexikid: A Graphic Memoir,OBOB Parent Group
mexikid-a-graphic-memoir,in-which-book,15,does a character describe his grandfather as old and stern?,,Pedro Martin,Mexikid: A Graphic Memoir,OBOB Parent Group
mexikid-a-graphic-memoir,in-which-book,16,can you either kiss an elder’s hand or be pinched by them?,,Pedro Martin,Mexikid: A Graphic Memoir,OBOB Parent Group
mexikid-a-graphic-memoir,in-which-book,17,does a family have a fridge where the top half (freezer) is covered with pictures of dead relatives?,,Pedro Martin,Mexikid: A Graphic Memoir,OBOB Parent Group
mexikid-a-graphic-memoir,in-which-book,22,"does a character have a sibling with a special ""skill"" called ""The Look!""?",,Pedro Martin,Mexikid: A Graphic Memoir,OBOB Parent Group
mexikid-a-graphic-memoir,in-which-book,22,does the father whistle by sucking in air instead of blowing out?,,Pedro Martin,Mexikid: A Graphic Memoir,OBOB Parent Group
mexikid-a-graphic-memoir,in-which-book,22,does everyone in the family have their own superpower?,,Pedro Martin,Mexikid: A Graphic Memoir,OBOB Parent Group
mexikid-a-graphic-memoir,in-which-book,23,"does a family shop at Kmart for the ""essentials"" before their road trip?",,Pedro Martin,Mexikid: A Graphic Memoir,OBOB Parent Group
mexikid-a-graphic-memoir,in-which-book,27,do characters call one character “Snack guy”?,,Pedro Martin,Mexikid: A Graphic Memoir,OBOB Parent Group
mexikid-a-graphic-memoir,in-which-book,36,"do the younger siblings refer to the older siblings as ""barn babies""?",,Pedro Martin,Mexikid: A Graphic Memoir,OBOB Parent Group
mexikid-a-graphic-memoir,in-which-book,38,does a family of 11 travel in a Winnebago Chieftain to Mexico?,,Pedro Martin,Mexikid: A Graphic Memoir,OBOB Parent Group
mexikid-a-graphic-memoir,in-which-book,40,does the dad customize a pickup truck and camper shell with a wooden bench and ropes for seat belts?,,Pedro Martin,Mexikid: A Graphic Memoir,OBOB Parent Group
mexikid-a-graphic-memoir,in-which-book,48,does a character compare a motor home to a pinball machine?,,Pedro Martin,Mexikid: A Graphic Memoir,OBOB Parent Group
mexikid-a-graphic-memoir,in-which-book,,does a family pass by all the roadside attractions on their road trip?,,Pedro Martin,Mexikid: A Graphic Memoir,OBOB Parent Group
mexikid-a-graphic-memoir,in-which-book,62,do characters play Kmart and put fake price tags on toys?,,Pedro Martin,Mexikid: A Graphic Memoir,OBOB Parent Group
mexikid-a-graphic-memoir,in-which-book,63,"is there a “Mexican Breakfast” dish that uses leftovers from the party the night before, plus some fried eggs.",,Pedro Martin,Mexikid: A Graphic Memoir,OBOB Parent Group
mexikid-a-graphic-memoir,in-which-book,64,does a family gather charity bundles to take to Mexico?,,Pedro Martin,Mexikid: A Graphic Memoir,OBOB Parent Group
mexikid-a-graphic-memoir,in-which-book,73,does a character use a “Mexican Jedi Mind Trick”?,,Pedro Martin,Mexikid: A Graphic Memoir,OBOB Parent Group
mexikid-a-graphic-memoir,in-which-book,74,does a family have a lot of their stuff taken by border guards?,,Pedro Martin,Mexikid: A Graphic Memoir,OBOB Parent Group
mexikid-a-graphic-memoir,in-which-book,78,does a character leave an action figure at the Mexican border?,,Pedro Martin,Mexikid: A Graphic Memoir,OBOB Parent Group
mexikid-a-graphic-memoir,in-which-book,80,is it mentioned that “Tijuana” translates to “doll town”?,,Pedro Martin,Mexikid: A Graphic Memoir,OBOB Parent Group
mexikid-a-graphic-memoir,in-which-book,81,does a character lose all his tapes he recorded and was left with only The Music Man by Meredith Wilson?,,Pedro Martin,Mexikid: A Graphic Memoir,OBOB Parent Group
mexikid-a-graphic-memoir,in-which-book,,does a family stop at a mercado for lunch?,,Pedro Martin,Mexikid: A Graphic Memoir,OBOB Parent Group
mexikid-a-graphic-memoir,in-which-book,88,does a character buy action figures that are badly painted and smell like gasoline?,,Pedro Martin,Mexikid: A Graphic Memoir,OBOB Parent Group
mexikid-a-graphic-memoir,in-which-book,89,"is there ""A Mexican Boy's Guide To: Unregulated Toys""",,Pedro Martin,Mexikid: A Graphic Memoir,OBOB Parent Group
mexikid-a-graphic-memoir,in-which-book,90,does a character buy a drink called licuados?,,Pedro Martin,Mexikid: A Graphic Memoir,OBOB Parent Group
mexikid-a-graphic-memoir,in-which-book,97,does a family's motorhome breakdown on a scary road because a kid was playing co-pilot and pulled a bunch of knobs?,,Pedro Martin,Mexikid: A Graphic Memoir,OBOB Parent Group
mexikid-a-graphic-memoir,in-which-book,107,does a father teach his kids “A good reputation is more valuable than money”?,,Pedro Martin,Mexikid: A Graphic Memoir,OBOB Parent Group
mexikid-a-graphic-memoir,in-which-book,110,does a character have a hard time drawing eyes and hands?,,Pedro Martin,Mexikid: A Graphic Memoir,OBOB Parent Group
mexikid-a-graphic-memoir,in-which-book,112,did the main character's parents own a hotel and restaurant when they were first married?,,Pedro Martin,Mexikid: A Graphic Memoir,OBOB Parent Group
mexikid-a-graphic-memoir,in-which-book,116,does the main character have to get water from down the street because the water tank on the roof is out of water?,,Pedro Martin,Mexikid: A Graphic Memoir,OBOB Parent Group
mexikid-a-graphic-memoir,in-which-book,118,is there a character that smells like fresh cow and wet hair?,,Pedro Martin,Mexikid: A Graphic Memoir,OBOB Parent Group
mexikid-a-graphic-memoir,in-which-book,121,does a character talk about the Cristeros Rebellion where the government decided that the church was getting too powerful so Catholicism had to go?,,Pedro Martin,Mexikid: A Graphic Memoir,OBOB Parent Group
mexikid-a-graphic-memoir,in-which-book,125,"do militant Catholics ""aggressively” question a character?",,Pedro Martin,Mexikid: A Graphic Memoir,OBOB Parent Group
mexikid-a-graphic-memoir,in-which-book,126,does a character fling men like they are rag dolls?,,Pedro Martin,Mexikid: A Graphic Memoir,OBOB Parent Group
mexikid-a-graphic-memoir,in-which-book,131,does a character get kicked in the head by a mule when they were younger?,,Pedro Martin,Mexikid: A Graphic Memoir,OBOB Parent Group
mexikid-a-graphic-memoir,in-which-book,135,does a character get a bad haircut in Mexico?,,Pedro Martin,Mexikid: A Graphic Memoir,OBOB Parent Group
mexikid-a-graphic-memoir,in-which-book,,does the main character's grandfather get attacked by road bandits?,,Pedro Martin,Mexikid: A Graphic Memoir,OBOB Parent Group
mexikid-a-graphic-memoir,in-which-book,135,does a barber disinfect a character’s neck with tequila?,,Pedro Martin,Mexikid: A Graphic Memoir,OBOB Parent Group
mexikid-a-graphic-memoir,in-which-book,135,does the hairdresser use tequila to disinfect the customer’s neck?,,Pedro Martin,Mexikid: A Graphic Memoir,OBOB Parent Group
mexikid-a-graphic-memoir,in-which-book,157,does a gingerbread cookie shaped like a pig have a candy cane for a tail?,,Pedro Martin,Mexikid: A Graphic Memoir,OBOB Parent Group
mexikid-a-graphic-memoir,in-which-book,157,does the main character buy a huge piggy cookie with the intention to give to a girl?,,Pedro Martin,Mexikid: A Graphic Memoir,OBOB Parent Group
mexikid-a-graphic-memoir,in-which-book,160,do flies keep getting stuck in the main characters giant cookie?,,Pedro Martin,Mexikid: A Graphic Memoir,OBOB Parent Group
mexikid-a-graphic-memoir,in-which-book,,does a character get pop rocks in his snot?,,Pedro Martin,Mexikid: A Graphic Memoir,OBOB Parent Group
mexikid-a-graphic-memoir,in-which-book,,does a character learn about his grandfather's adventures through stories told by others?,,Pedro Martin,Mexikid: A Graphic Memoir,OBOB Parent Group
mexikid-a-graphic-memoir,in-which-book,170,does the main character say goodbye to his brother by playing music on a tape recorder through a CB radio?,,Pedro Martin,Mexikid: A Graphic Memoir,OBOB Parent Group
mexikid-a-graphic-memoir,in-which-book,174,does a character not have time for a custom-made coffin?,,Pedro Martin,Mexikid: A Graphic Memoir,OBOB Parent Group
mexikid-a-graphic-memoir,in-which-book,181,does a character indirectly die from eating an ice cream bar too fast?,,Pedro Martin,Mexikid: A Graphic Memoir,OBOB Parent Group
mexikid-a-graphic-memoir,in-which-book,182,does a character lose four of his brothers as children?,,Pedro Martin,Mexikid: A Graphic Memoir,OBOB Parent Group
mexikid-a-graphic-memoir,in-which-book,183,is a cemetery flooding?,,Pedro Martin,Mexikid: A Graphic Memoir,OBOB Parent Group
mexikid-a-graphic-memoir,in-which-book,183,does the underground river shift its course and start to flow under the cemetery?,,Pedro Martin,Mexikid: A Graphic Memoir,OBOB Parent Group
mexikid-a-graphic-memoir,in-which-book,184,do characters dig up the remains of their grandmother/mom/wife?,,Pedro Martin,Mexikid: A Graphic Memoir,OBOB Parent Group
mexikid-a-graphic-memoir,in-which-book,185,do the characters have breakfast with a coffin placed right on the table?,,Pedro Martin,Mexikid: A Graphic Memoir,OBOB Parent Group
mexikid-a-graphic-memoir,in-which-book,192,does a character wish he could go back in time and give his dad his comic book money?,,Pedro Martin,Mexikid: A Graphic Memoir,OBOB Parent Group
mexikid-a-graphic-memoir,in-which-book,192,was a parent of the main character so poor that they had to run away to a faraway place to make money at sixteen?,,Pedro Martin,Mexikid: A Graphic Memoir,OBOB Parent Group
mexikid-a-graphic-memoir,in-which-book,196,"does a character make up the word ""saddersweet""?",,Pedro Martin,Mexikid: A Graphic Memoir,OBOB Parent Group
mexikid-a-graphic-memoir,in-which-book,197,do characters have a “saddersweet” moment?,,Pedro Martin,Mexikid: A Graphic Memoir,OBOB Parent Group
mexikid-a-graphic-memoir,in-which-book,204,does a character offer to share a cold soda with another character?,,Pedro Martin,Mexikid: A Graphic Memoir,OBOB Parent Group
mexikid-a-graphic-memoir,in-which-book,210,"does a character sing a song called ""Prieta Linda""?",,Pedro Martin,Mexikid: A Graphic Memoir,OBOB Parent Group
mexikid-a-graphic-memoir,in-which-book,210,does a character sing a song called “Prieta Linda”?,,Pedro Martin,Mexikid: A Graphic Memoir,OBOB Parent Group
mexikid-a-graphic-memoir,in-which-book,229,does a character pay a lot of money for fake fireworks?,,Pedro Martin,Mexikid: A Graphic Memoir,OBOB Parent Group
mexikid-a-graphic-memoir,in-which-book,236,do some of the character sleep on top of a motorhome one night?,,Pedro Martin,Mexikid: A Graphic Memoir,OBOB Parent Group
