book_key,question_type,page,text,answer,author_name,book_title,source_name
mexikid-a-graphic-memoir,in-which-book,239,do the characters take an 18 hour ferry ride to Cabo San Lucas?,,Pedro Martin,Mexikid: A Graphic Memoir,OBOB Parent Group
mexikid-a-graphic-memoir,in-which-book,239,do characters take a 18-hour ferry trip?,,Pedro Martin,Mexikid: A Graphic Memoir,OBOB Parent Group
mexikid-a-graphic-memoir,in-which-book,247,does a gas station run out of gas causing a traffic jam in the desert?,,Pedro Martin,Mexikid: A Graphic Memoir,OBOB Parent Group
mexikid-a-graphic-memoir,in-which-book,,does a mom use an avocado to teach her child a life lesson?,,Pedro Martin,Mexikid: A Graphic Memoir,OBOB Parent Group
mexikid-a-graphic-memoir,in-which-book,304,does a character attempt to perform surgery on a deer?,,Pedro Martin,Mexikid: A Graphic Memoir,OBOB Parent Group
mexikid-a-graphic-memoir,in-which-book,,has a family of 11 including 2 parents and 9 kids?,,Pedro Martin,Mexikid: A Graphic Memoir,OBOB Parent Group
mexikid-a-graphic-memoir,in-which-book,10,does someone enjoy watching the show Happy Days because it drowns out conversation from the adults?,,Pedro Martin,Mexikid: A Graphic Memoir,Lake Oswego Public Library
mexikid-a-graphic-memoir,in-which-book,18,is someone’s grandmother rumored to have died from brain freeze while eating ice cream?,,Pedro Martin,Mexikid: A Graphic Memoir,Lake Oswego Public Library
mexikid-a-graphic-memoir,in-which-book,38,does someone travel with their family in a Winnebago Chieftain motorhome?,,Pedro Martin,Mexikid: A Graphic Memoir,Lake Oswego Public Library
mexikid-a-graphic-memoir,in-which-book,72,does a family have their toys and other belongings confiscated by border guards?,,Pedro Martin,Mexikid: A Graphic Memoir,Lake Oswego Public Library
mexikid-a-graphic-memoir,in-which-book,93,does someone get suddenly sick from drinking a beverage containing raw milk?,,Pedro Martin,Mexikid: A Graphic Memoir,Lake Oswego Public Library
mexikid-a-graphic-memoir,in-which-book,107,does someone’s father pass on the life lesson that a good reputation is more valuable than money?,,Pedro Martin,Mexikid: A Graphic Memoir,Lake Oswego Public Library
mexikid-a-graphic-memoir,in-which-book,115,are kids ordered to take a bath because they are “sticky with Fanta and dirt?,,Pedro Martin,Mexikid: A Graphic Memoir,Lake Oswego Public Library
mexikid-a-graphic-memoir,in-which-book,121,does someone get a haircut inspired by musician Vincente Fernandez?,,Pedro Martin,Mexikid: A Graphic Memoir,Lake Oswego Public Library
mexikid-a-graphic-memoir,in-which-book,150,does someone’s grandfather defeat road bandits with a slingshot?,,Pedro Martin,Mexikid: A Graphic Memoir,Lake Oswego Public Library
mexikid-a-graphic-memoir,in-which-book,184,does a family have to dig up the remains of their grandmother’s grave because a nearby river has started flowing a different way?,,Pedro Martin,Mexikid: A Graphic Memoir,Lake Oswego Public Library
mexikid-a-graphic-memoir,in-which-book,230,does someone spend a lot of money on fireworks just to discover that they are fakes?,,Pedro Martin,Mexikid: A Graphic Memoir,Lake Oswego Public Library
mexikid-a-graphic-memoir,in-which-book,247,does someone receive a warning to stay out of the desert because of the snakes and scorpions that live there?,,Pedro Martin,Mexikid: A Graphic Memoir,Lake Oswego Public Library
mexikid-a-graphic-memoir,in-which-book,247,does a traveling family encounter a traffic jam in the middle of nowhere because the local gas station has run out of gas?,,Pedro Martin,Mexikid: A Graphic Memoir,Lake Oswego Public Library
mexikid-a-graphic-memoir,in-which-book,253,"does a character say you should only hunt to eat, not for fun?",,Pedro Martin,Mexikid: A Graphic Memoir,OBOB Parent Group
mexikid-a-graphic-memoir,in-which-book,269,does a family put an injured deer in their motorhome?,,Pedro Martin,Mexikid: A Graphic Memoir,Lake Oswego Public Library
mexikid-a-graphic-memoir,in-which-book,287,does a character try to amputate the hoof of a deer?,,Pedro Martin,Mexikid: A Graphic Memoir,OBOB Parent Group
mexikid-a-graphic-memoir,in-which-book,293,do siblings use a machete to take the caps off a truck battery and fireworks to see well enough to find a source of water?,,Pedro Martin,Mexikid: A Graphic Memoir,Lake Oswego Public Library
mexikid-a-graphic-memoir,in-which-book,305,does someone raise a toast in honor of their grandson by shouting “Long live the Deer Surgeon?”,,Pedro Martin,Mexikid: A Graphic Memoir,Lake Oswego Public Library