book_key,question_type,page,text,answer,author_name,book_title,source_name
projekt-1065-a-novel-of-world-war-ii,in-which-book,83,does a test include jumping off a 2 story building into a pool?,,Alan Gratz,Projekt 1065: A Novel of World War II,OBOB Parent Group
projekt-1065-a-novel-of-world-war-ii,in-which-book,85,does the air sometimes smell like burning metal and spent fireworks and taste like fireplace ash and cement dust?,,Alan Gratz,Projekt 1065: A Novel of World War II,OBOB Parent Group
projekt-1065-a-novel-of-world-war-ii,in-which-book,91,is a character afraid of birds?,,Alan Gratz,Projekt 1065: A Novel of World War II,OBOB Parent Group
projekt-1065-a-novel-of-world-war-ii,in-which-book,91,does someone state “A bevy of quail makes me quail?”,,Alan Gratz,Projekt 1065: A Novel of World War II,Lake Oswego Public Library
projekt-1065-a-novel-of-world-war-ii,in-which-book,95,do they let the air out of car tires?,,Alan Gratz,Projekt 1065: A Novel of World War II,Lake Oswego Public Library
projekt-1065-a-novel-of-world-war-ii,in-which-book,97,does a character tell a friend thier little sister is creepy?,,Alan Gratz,Projekt 1065: A Novel of World War II,OBOB Parent Group
projekt-1065-a-novel-of-world-war-ii,in-which-book,98,do two characters get into a fistfight over a seat at school?,,Alan Gratz,Projekt 1065: A Novel of World War II,OBOB Parent Group
projekt-1065-a-novel-of-world-war-ii,in-which-book,98,is there a classmate named Willi?,,Alan Gratz,Projekt 1065: A Novel of World War II,Lake Oswego Public Library
projekt-1065-a-novel-of-world-war-ii,in-which-book,104,"do the characters learn that every race in the world can be divided into 3 groups -  culture founders, culture maintainers, and culture destroyers?",,Alan Gratz,Projekt 1065: A Novel of World War II,OBOB Parent Group
projekt-1065-a-novel-of-world-war-ii,in-which-book,109,does someone state “I have to see a man about a horse?”,,Alan Gratz,Projekt 1065: A Novel of World War II,Lake Oswego Public Library
projekt-1065-a-novel-of-world-war-ii,in-which-book,111,"does the main character say ""Wolfe's smart, but he's a jerk""?",,Alan Gratz,Projekt 1065: A Novel of World War II,OBOB Parent Group
projekt-1065-a-novel-of-world-war-ii,in-which-book,111,"does someone read the book, The Golden Spiders?",,Alan Gratz,Projekt 1065: A Novel of World War II,Lake Oswego Public Library
projekt-1065-a-novel-of-world-war-ii,in-which-book,118,"are characters tested by running 60 meters, long jumping, and throwing a softball?",,Alan Gratz,Projekt 1065: A Novel of World War II,OBOB Parent Group
projekt-1065-a-novel-of-world-war-ii,in-which-book,124,had someone attended St. Paul’s Grammar School?,,Alan Gratz,Projekt 1065: A Novel of World War II,Lake Oswego Public Library
projekt-1065-a-novel-of-world-war-ii,in-which-book,134,is the main character expecting someone to be mad but is greeted with a hug instead?,,Alan Gratz,Projekt 1065: A Novel of World War II,OBOB Parent Group
projekt-1065-a-novel-of-world-war-ii,in-which-book,135,do characters plummet 20 feet into ice cold water?,,Alan Gratz,Projekt 1065: A Novel of World War II,OBOB Parent Group
projekt-1065-a-novel-of-world-war-ii,in-which-book,138,did the main characters friend push them off a two story building?,,Alan Gratz,Projekt 1065: A Novel of World War II,OBOB Parent Group
projekt-1065-a-novel-of-world-war-ii,in-which-book,143,are characters given a dagger to wear in a metal sheeth on thier belts at all times?,,Alan Gratz,Projekt 1065: A Novel of World War II,OBOB Parent Group
projekt-1065-a-novel-of-world-war-ii,in-which-book,146,does someone have drawings of airplanes pinned to the wall of their bedroom?,,Alan Gratz,Projekt 1065: A Novel of World War II,Lake Oswego Public Library
projekt-1065-a-novel-of-world-war-ii,in-which-book,159,a chacter ean the nickname of Quex (short for quicksilver)?,,Alan Gratz,Projekt 1065: A Novel of World War II,OBOB Parent Group
projekt-1065-a-novel-of-world-war-ii,in-which-book,165,"did a teacher say ""Sit down and shut up, you brats""?",,Alan Gratz,Projekt 1065: A Novel of World War II,OBOB Parent Group
projekt-1065-a-novel-of-world-war-ii,in-which-book,166,are characters assigned to a special science team?,,Alan Gratz,Projekt 1065: A Novel of World War II,OBOB Parent Group
projekt-1065-a-novel-of-world-war-ii,in-which-book,176,"are characters taught ""Sometimes you do what you have to do, even if doing it means doing something wrong"".?",,Alan Gratz,Projekt 1065: A Novel of World War II,OBOB Parent Group
projekt-1065-a-novel-of-world-war-ii,in-which-book,182,does a 10 year old tell a 13 year old that they can get married?,,Alan Gratz,Projekt 1065: A Novel of World War II,OBOB Parent Group
projekt-1065-a-novel-of-world-war-ii,in-which-book,205,is there an Operation Paperclip?,,Alan Gratz,Projekt 1065: A Novel of World War II,Lake Oswego Public Library
projekt-1065-a-novel-of-world-war-ii,in-which-book,212,is a deliver of a case of wine a code for something else?,,Alan Gratz,Projekt 1065: A Novel of World War II,OBOB Parent Group
projekt-1065-a-novel-of-world-war-ii,in-which-book,215,is there an opening for a member on a science team?,,Alan Gratz,Projekt 1065: A Novel of World War II,OBOB Parent Group
projekt-1065-a-novel-of-world-war-ii,in-which-book,226,"was a speech given telling children to be ""...violently active. Dominating. Intrepid. Brutal.""",,Alan Gratz,Projekt 1065: A Novel of World War II,OBOB Parent Group
projekt-1065-a-novel-of-world-war-ii,in-which-book,228,are people described as zealots?,,Alan Gratz,Projekt 1065: A Novel of World War II,Lake Oswego Public Library
projekt-1065-a-novel-of-world-war-ii,in-which-book,229,did the main character have to turn in a friend to prove their dedication?,,Alan Gratz,Projekt 1065: A Novel of World War II,OBOB Parent Group
projekt-1065-a-novel-of-world-war-ii,in-which-book,235,did the main character burn all his detective novels?,,Alan Gratz,Projekt 1065: A Novel of World War II,OBOB Parent Group
projekt-1065-a-novel-of-world-war-ii,in-which-book,235,does a character throw thier collection of detective novels into a bucket of flames?,,Alan Gratz,Projekt 1065: A Novel of World War II,OBOB Parent Group
projekt-1065-a-novel-of-world-war-ii,in-which-book,252,do characters travel by cable car to a mountain resort?,,Alan Gratz,Projekt 1065: A Novel of World War II,OBOB Parent Group
projekt-1065-a-novel-of-world-war-ii,in-which-book,253,"does a person brag they are such a good driver, they can go within 1 inch of the cliff and not fall off?",,Alan Gratz,Projekt 1065: A Novel of World War II,OBOB Parent Group
projekt-1065-a-novel-of-world-war-ii,in-which-book,253,does a character tell jokes to distract himself?,,Alan Gratz,Projekt 1065: A Novel of World War II,OBOB Parent Group
projekt-1065-a-novel-of-world-war-ii,in-which-book,255,"do they refer to a long line as a ""waiting snake""?",,Alan Gratz,Projekt 1065: A Novel of World War II,OBOB Parent Group
projekt-1065-a-novel-of-world-war-ii,in-which-book,258,does a character hide something in a stone wall?,,Alan Gratz,Projekt 1065: A Novel of World War II,OBOB Parent Group
projekt-1065-a-novel-of-world-war-ii,in-which-book,261,do characters talk about the medals and hero's welcome they will receive?,,Alan Gratz,Projekt 1065: A Novel of World War II,OBOB Parent Group
projekt-1065-a-novel-of-world-war-ii,in-which-book,292,do characters trigger an avalance?,,Alan Gratz,Projekt 1065: A Novel of World War II,OBOB Parent Group
projekt-1065-a-novel-of-world-war-ii,in-which-book,295,"does a character believe that ""might makes right""",,Alan Gratz,Projekt 1065: A Novel of World War II,OBOB Parent Group
projekt-1065-a-novel-of-world-war-ii,in-which-book,298,did an avalanche sound like thunder?,,Alan Gratz,Projekt 1065: A Novel of World War II,OBOB Parent Group
projekt-1065-a-novel-of-world-war-ii,in-which-book,299,does the main character have an absolutely incredible memory for detail?,,Alan Gratz,Projekt 1065: A Novel of World War II,OBOB Parent Group
projekt-1065-a-novel-of-world-war-ii,in-which-book,301,"does the main character hone his memory skills by playing ""Kim's Game"" night after night",,Alan Gratz,Projekt 1065: A Novel of World War II,OBOB Parent Group
projekt-1065-a-novel-of-world-war-ii,in-which-book,302,did the main character join the International world of espionage?,,Alan Gratz,Projekt 1065: A Novel of World War II,OBOB Parent Group