book_key,question_type,page,text,answer,author_name,book_title,source_name
before-ever-after,in-which-book,16,"was somone left ""outside a Texas church in a basket"" as a baby?",,Jacqueline Woodson,Before the Ever After,OBOB Practice-Question Coalition
before-ever-after,in-which-book,19,do they listen to the Beastie Boys after the first day of school?,,Jacqueline Woodson,Before the Ever After,Lake Oswego Library
before-ever-after,in-which-book,19,"was Beastie Boys ""blasting from the car radio"" on the first day of first grade?",,Jacqueline Woodson,Before the Ever After,OBOB Practice-Question Coalition
before-ever-after,in-which-book,21,"do they have pizza night with extra cheese, extra sausage and lots of olives?",,Jacqueline Woodson,Before the Ever After,Lake Oswego Library
before-ever-after,in-which-book,21,"does a character have a pizza with extra cheese, extra sausage, and lots of olives on pizza night?",,Jacqueline Woodson,Before the Ever After,OBOB Practice-Question Coalition
before-ever-after,in-which-book,21,is a character's kitchen bright yellow?,,Jacqueline Woodson,Before the Ever After,OBOB Practice-Question Coalition
before-ever-after,in-which-book,25,did someone’s grandma lose a leg because of diabetes?,,Jacqueline Woodson,Before the Ever After,Lake Oswego Library
before-ever-after,in-which-book,25,does someone say they cried every day the year their dad died?,,Jacqueline Woodson,Before the Ever After,OBOB Practice-Question Coalition
before-ever-after,in-which-book,25,does someone cry every day for a year after their father died?,,Jacqueline Woodson,Before the Ever After,Beaverton City Library
before-ever-after,in-which-book,27,"does a chracter only want to read ""realistic fiction""?",,Jacqueline Woodson,Before the Ever After,OBOB Practice-Question Coalition
before-ever-after,in-which-book,27,"does someone read ""Realistic Fiction"" on Saturday mornings?",,Jacqueline Woodson,Before the Ever After,OBOB Practice-Question Coalition
before-ever-after,in-which-book,28,"does a character say, ""But still, most people seem to end up okay""?",,Jacqueline Woodson,Before the Ever After,OBOB Practice-Question Coalition
before-ever-after,in-which-book,30,does someone wear size 14 shoes?,,Jacqueline Woodson,Before the Ever After,Cedar Mill Library
before-ever-after,in-which-book,30,"does someone have a ""Race Day"" with his dad?",,Jacqueline Woodson,Before the Ever After,Beaverton City Library
before-ever-after,in-which-book,32,"does someone say, ""I love you...—body, brain, and soul""?",,Jacqueline Woodson,Before the Ever After,OBOB Practice-Question Coalition
before-ever-after,in-which-book,38,"does a character describe the silence in their house as ""like a bruise. Silent. Painful""?",,Jacqueline Woodson,Before the Ever After,OBOB Practice-Question Coalition
before-ever-after,in-which-book,38,"does someone describe the quiet in their house ""like a bruise. Silent. Painful""?",,Jacqueline Woodson,Before the Ever After,OBOB Practice-Question Coalition
before-ever-after,in-which-book,40,does the character live 8 blocks away from school?,,Jacqueline Woodson,Before the Ever After,Lake Oswego Library
before-ever-after,in-which-book,42,"does someone say, ""Feels like we're in deep water""?",,Jacqueline Woodson,Before the Ever After,OBOB Practice-Question Coalition
before-ever-after,in-which-book,44,are they doing a puzzle with a Yeti on top of a mountain?,,Jacqueline Woodson,Before the Ever After,Lake Oswego Library
before-ever-after,in-which-book,44,does a character work on a puzzle with a Yeti on top of a mountain?,,Jacqueline Woodson,Before the Ever After,OBOB Practice-Question Coalition
before-ever-after,in-which-book,44,"does someone show up on their friend's doorstep wearing a ""striped raincoat and blue rain boots""?",,Jacqueline Woodson,Before the Ever After,OBOB Practice-Question Coalition
before-ever-after,in-which-book,44,does someone work on a puzzle of a Yeti on a mountaintop?,,Jacqueline Woodson,Before the Ever After,OBOB Practice-Question Coalition
before-ever-after,in-which-book,46,does someone have a red afro?,,Jacqueline Woodson,Before the Ever After,Beaverton City Library
before-ever-after,in-which-book,47,"does someone listen to the band Earth, Wind, & Fire?",,Jacqueline Woodson,Before the Ever After,Cedar Mill Library
before-ever-after,in-which-book,48,"does someone eat ten cookies, drink one glass of milk, and drink three glasses of water all in one afternoon?",,Jacqueline Woodson,Before the Ever After,OBOB Practice-Question Coalition
before-ever-after,in-which-book,53,"does a character name a crab apple tree ""Crabby""?",,Jacqueline Woodson,Before the Ever After,OBOB Practice-Question Coalition
before-ever-after,in-which-book,53,"does someone name an oak tree ""Maple""?",,Jacqueline Woodson,Before the Ever After,OBOB Practice-Question Coalition
before-ever-after,in-which-book,53,"does someone have an oak tree that they've named ""Maple""?",,Jacqueline Woodson,Before the Ever After,Beaverton City Library
before-ever-after,in-which-book,55,"does someone look at the sky and say they are ""looking for God""?",,Jacqueline Woodson,Before the Ever After,OBOB Practice-Question Coalition
before-ever-after,in-which-book,56,"does a teacher say, ""Welcome back from the World of Daydreams""?",,Jacqueline Woodson,Before the Ever After,OBOB Practice-Question Coalition
before-ever-after,in-which-book,57,"does someone get startled and say, ""You scared me into next week""?",,Jacqueline Woodson,Before the Ever After,OBOB Practice-Question Coalition
before-ever-after,in-which-book,61,does a character say that chocolate helps them think?,,Jacqueline Woodson,Before the Ever After,OBOB Practice-Question Coalition
before-ever-after,in-which-book,61,"does someone say ""Chocolate helps me think""?",,Jacqueline Woodson,Before the Ever After,OBOB Practice-Question Coalition
before-ever-after,in-which-book,62,does a character take their coffee with one sugar and a little milk?,,Jacqueline Woodson,Before the Ever After,OBOB Practice-Question Coalition
before-ever-after,in-which-book,63,"does someone say ""Look on the bright side...you're a total chauvinist""?",,Jacqueline Woodson,Before the Ever After,OBOB Practice-Question Coalition
before-ever-after,in-which-book,63,is someone told they can't drive anymore?,,Jacqueline Woodson,Before the Ever After,Beaverton City Library
before-ever-after,in-which-book,64,"does a character say, ""What's your name again, boy?""",,Jacqueline Woodson,Before the Ever After,OBOB Practice-Question Coalition
before-ever-after,in-which-book,68,is someone lifted onto shoulders and called a good luck charm?,,Jacqueline Woodson,Before the Ever After,Beaverton City Library
before-ever-after,in-which-book,70,"are a character's hands described as ""shaking like dead leaves shake just before the wind blows them off the trees""?",,Jacqueline Woodson,Before the Ever After,OBOB Practice-Question Coalition
before-ever-after,in-which-book,71,"does someone think remember an ant ""walking in circles, its antennae searching the empty air for the friends it had lost""?",,Jacqueline Woodson,Before the Ever After,OBOB Practice-Question Coalition
before-ever-after,in-which-book,75,"do they eat breakfast for dinner, pancakes and bacon and scrambled eggs?",,Jacqueline Woodson,Before the Ever After,Lake Oswego Library
before-ever-after,in-which-book,75,"does a character eat pancakes, bacon, and scrambled eggs for dinner?",,Jacqueline Woodson,Before the Ever After,OBOB Practice-Question Coalition
before-ever-after,in-which-book,78,did someone receive a guitar on their seventh birthday?,,Jacqueline Woodson,Before the Ever After,Lake Oswego Library
before-ever-after,in-which-book,78,"does a character eat ten cookies, one glass of milk, three glasses of water, and a beef patty, all in one afternoon?",,Jacqueline Woodson,Before the Ever After,OBOB Practice-Question Coalition
before-ever-after,in-which-book,78,does a character receive a six-string acoustic guitar when they turned seven?,,Jacqueline Woodson,Before the Ever After,OBOB Practice-Question Coalition
before-ever-after,in-which-book,78,"does someone say that the only instrument in their house was ""a broke-down banjo"" with only one string on it?",,Jacqueline Woodson,Before the Ever After,OBOB Practice-Question Coalition
before-ever-after,in-which-book,78,"does someone have a ""ballroom"" in their house?",,Jacqueline Woodson,Before the Ever After,OBOB Practice-Question Coalition
before-ever-after,in-which-book,82,"did someone used to make ""little lemon cakes that looked like tiny loaves of bread""?",,Jacqueline Woodson,Before the Ever After,OBOB Practice-Question Coalition
before-ever-after,in-which-book,84,"does a character say that they ""saw the reddest cardinal ever""?",,Jacqueline Woodson,Before the Ever After,OBOB Practice-Question Coalition
before-ever-after,in-which-book,84,"does someone see ""the reddest cardinal ever"" sitting in an oak tree?",,Jacqueline Woodson,Before the Ever After,OBOB Practice-Question Coalition
before-ever-after,in-which-book,85,do the cops get called to a character's house because someone complained about the character's dad?,,Jacqueline Woodson,Before the Ever After,OBOB Practice-Question Coalition
before-ever-after,in-which-book,86,"does someone hide under the dining room table and ""put their fingers inside their ears""?",,Jacqueline Woodson,Before the Ever After,OBOB Practice-Question Coalition
before-ever-after,in-which-book,91,is someone recommended a doctor in Philadelphia?,,Jacqueline Woodson,Before the Ever After,OBOB Practice-Question Coalition
before-ever-after,in-which-book,92,does someone have a pillow that smells like lavender oil?,,Jacqueline Woodson,Before the Ever After,Lake Oswego Library
before-ever-after,in-which-book,93,does a character's pajamas have blue and pink poodles printed all over them?,,Jacqueline Woodson,Before the Ever After,OBOB Practice-Question Coalition
before-ever-after,in-which-book,93,does a boy have pink and blue poodles on his jammies?,,Jacqueline Woodson,Before the Ever After,OBOB Practice-Question Coalition
before-ever-after,in-which-book,97,does a character say it rained sixteen days straight before they were born?,,Jacqueline Woodson,Before the Ever After,OBOB Practice-Question Coalition
before-ever-after,in-which-book,101,"does someone say there's ""Something big. Something broken that I don't know how to fix""?",,Jacqueline Woodson,Before the Ever After,OBOB Practice-Question Coalition
before-ever-after,in-which-book,102,does someone write a haiku for a family member?,,Jacqueline Woodson,Before the Ever After,OBOB Practice-Question Coalition
before-ever-after,in-which-book,102,does someone write a haiku for their dad?,,Jacqueline Woodson,Before the Ever After,Beaverton City Library
before-ever-after,in-which-book,104,", when eating dinner at a friend's house, does a character put liver and onions in the pocket of their coat, in order to ""not embarass [their] firend or insult [their] mama""?",,Jacqueline Woodson,Before the Ever After,OBOB Practice-Question Coalition
before-ever-after,in-which-book,105,"does someone ""drop beats"" with his dad?",,Jacqueline Woodson,Before the Ever After,Beaverton City Library
before-ever-after,in-which-book,107,"does a character say ""I don't believe in gravity""?",,Jacqueline Woodson,Before the Ever After,OBOB Practice-Question Coalition
before-ever-after,in-which-book,111,"does someone listen to the song ""September"" by Earth, Wind, & Fire?",,Jacqueline Woodson,Before the Ever After,OBOB Practice-Question Coalition
before-ever-after,in-which-book,114,is the phrase “I need the trail” used as a code?,,Jacqueline Woodson,Before the Ever After,Lake Oswego Library
before-ever-after,in-which-book,117,"does someone have ""lucky snow gloves""?",,Jacqueline Woodson,Before the Ever After,OBOB Practice-Question Coalition
before-ever-after,in-which-book,121,"does someone's picture look like they ""ate the moon and it came shining back out""?",,Jacqueline Woodson,Before the Ever After,OBOB Practice-Question Coalition
before-ever-after,in-which-book,126,does someone wear a watch they got for their thirtieth birthday?,,Jacqueline Woodson,Before the Ever After,OBOB Practice-Question Coalition
before-ever-after,in-which-book,128,do they reference the song “I Wanna Dance With Somebody” by Whitney Houston?,,Jacqueline Woodson,Before the Ever After,Lake Oswego Library
before-ever-after,in-which-book,130,is one of someone's favorite singers named Rufus Wainwright?,,Jacqueline Woodson,Before the Ever After,Beaverton City Library
before-ever-after,in-which-book,132,is there a party for someone's 35th birthday?,,Jacqueline Woodson,Before the Ever After,Cedar Mill Library
before-ever-after,in-which-book,132,does a character have a birthday party with blue and gold streamers haning from the lights?,,Jacqueline Woodson,Before the Ever After,OBOB Practice-Question Coalition
before-ever-after,in-which-book,132,does someone make a paper-mâché mountain?,,Jacqueline Woodson,Before the Ever After,OBOB Practice-Question Coalition
before-ever-after,in-which-book,138,does a character laugh so hard that soda comes out of their nose?,,Jacqueline Woodson,Before the Ever After,OBOB Practice-Question Coalition
before-ever-after,in-which-book,148,"does a living room window look out over a side yard with a  rododendron, rose vines, bay leaf, and lavender?",,Jacqueline Woodson,Before the Ever After,OBOB Practice-Question Coalition
before-ever-after,in-which-book,149,"does someone write but not know how to finish ""Maplewood Blues Song""?",,Jacqueline Woodson,Before the Ever After,OBOB Practice-Question Coalition
before-ever-after,in-which-book,153,does a character's dad like to sing a song from a show called The Partridge Family?,,Jacqueline Woodson,Before the Ever After,OBOB Practice-Question Coalition
before-ever-after,in-which-book,155,"does a character punch through a window and repeat the sentence, ""I have to get to that plane""?",,Jacqueline Woodson,Before the Ever After,OBOB Practice-Question Coalition
before-ever-after,in-which-book,155,does someone cut their hand on a window and leave the house in a stretcher?,,Jacqueline Woodson,Before the Ever After,OBOB Practice-Question Coalition
before-ever-after,in-which-book,160,"does a character have to visit their father in a hospital ""during certain times"" because they are only 12?",,Jacqueline Woodson,Before the Ever After,OBOB Practice-Question Coalition