book_key,question_type,page,text,answer,author_name,book_title,source_name
twins,in-which-book,13,do three friends dress alike for the first day of 6th grade?,,Varian Johnson and Shannon Wright,Twins,OBOB Practice-Question Coalition
twins,in-which-book,19,"does a character say ""we don't hold hands to walk to the cafeteria""?",,Varian Johnson and Shannon Wright,Twins,OBOB Practice-Question Coalition
twins,in-which-book,19,"does a teacher say, ""we don't hold hands to walk to the cafeteria. you go to lunch, then report to fifth period""?",,Varian Johnson and Shannon Wright,Twins,Beaverton City Library
twins,in-which-book,20,"is the school mascot ""the Jaguars""?",,Varian Johnson and Shannon Wright,Twins,OBOB Practice-Question Coalition
twins,in-which-book,20,"do none of the kids seem ""like a good fit"" to eat lunch with because they are ""too loud,"" ""too mean,"" ""too diva,"" or ""too popular""?",,Varian Johnson and Shannon Wright,Twins,OBOB Practice-Question Coalition
twins,in-which-book,21,"do certain lunch tables have nicknames like “Ribbon Ravine,” “Jock Mountain,” and “Valley of Burps & Smells?”",,Varian Johnson and Shannon Wright,Twins,Lake Oswego Library
twins,in-which-book,24,does a character eat lunch in the library alone at the beginning of sixth grade?,,Varian Johnson and Shannon Wright,Twins,Lake Oswego Library
twins,in-which-book,25,is the library referred to as No Man's Land?,,Varian Johnson and Shannon Wright,Twins,OBOB Practice-Question Coalition
twins,in-which-book,26,was a character previously in the US Army and severed tours in Afghanistan and Korea?,,Varian Johnson and Shannon Wright,Twins,OBOB Practice-Question Coalition
twins,in-which-book,26,"is someone either addressed ""master sargeant"" or ""ma'am""?",,Varian Johnson and Shannon Wright,Twins,Beaverton City Library
twins,in-which-book,27,is there a class where students can earn a higher rank throughout the year?,,Varian Johnson and Shannon Wright,Twins,Lake Oswego Library
twins,in-which-book,27,is there a character named Bryce Jackson?,,Varian Johnson and Shannon Wright,Twins,Cedar Mill Library
twins,in-which-book,28,do characters practice marching in a parking lot?,,Varian Johnson and Shannon Wright,Twins,OBOB Practice-Question Coalition
twins,in-which-book,30,is someone thinking of running for student councel?,,Varian Johnson and Shannon Wright,Twins,Beaverton City Library
twins,in-which-book,37,"does a character say, ""It's like every other kid has either taken private lessons or is a natural-born singer"".?",,Varian Johnson and Shannon Wright,Twins,OBOB Practice-Question Coalition
twins,in-which-book,39,"does a character say of her sister, ""She could make friends with a rock.""",,Varian Johnson and Shannon Wright,Twins,OBOB Practice-Question Coalition
twins,in-which-book,40,does a character have an older half brother out of college who has their own apartment?,,Varian Johnson and Shannon Wright,Twins,Lake Oswego Library
twins,in-which-book,41,is a main character's brother a first grade teacher?,,Varian Johnson and Shannon Wright,Twins,OBOB Practice-Question Coalition
twins,in-which-book,41,is someone's half brother a new kindergarten teacher?,,Varian Johnson and Shannon Wright,Twins,Beaverton City Library
twins,in-which-book,45,"does a character warn, ""Just remember, the mall can be a dangerous place!""?",,Varian Johnson and Shannon Wright,Twins,OBOB Practice-Question Coalition
twins,in-which-book,48,is there a store in the mall called Temporarily 22?,,Varian Johnson and Shannon Wright,Twins,OBOB Practice-Question Coalition
twins,in-which-book,48,"is there a store called ""Temporarily 22""?",,Varian Johnson and Shannon Wright,Twins,OBOB Practice-Question Coalition
twins,in-which-book,54,"does a student shout, ""Squad, ATTEN-HUT! DIS-MISSED!""?",,Varian Johnson and Shannon Wright,Twins,OBOB Practice-Question Coalition
twins,in-which-book,56,is being bad at drill enough to drop a grade from an A to a B?,,Varian Johnson and Shannon Wright,Twins,OBOB Practice-Question Coalition
twins,in-which-book,57,"does a student say, ""A cadet never lies!""",,Varian Johnson and Shannon Wright,Twins,OBOB Practice-Question Coalition
twins,in-which-book,60,"does a character say, ""I promised I'd do everything I could to boost your self-confidence.""?",,Varian Johnson and Shannon Wright,Twins,OBOB Practice-Question Coalition
twins,in-which-book,61,is a character offered extra credit for running for student council?,,Varian Johnson and Shannon Wright,Twins,Lake Oswego Library
twins,in-which-book,63,"does a character say, ""Careful with the door, you don't want to hurt the cars feelings.""?",,Varian Johnson and Shannon Wright,Twins,OBOB Practice-Question Coalition
twins,in-which-book,69,"does a character say, ""I asked Mom and Dad to put us in separate classes.""?",,Varian Johnson and Shannon Wright,Twins,OBOB Practice-Question Coalition
twins,in-which-book,70,"does someone say, ""everyone thinks we're interchangeable. like it doesn't matter if it's you or me""?",,Varian Johnson and Shannon Wright,Twins,Beaverton City Library
twins,in-which-book,71,"does a character say, ""If you're so self-confident, why are you still hiding in the library during lunch""?",,Varian Johnson and Shannon Wright,Twins,OBOB Practice-Question Coalition
twins,in-which-book,75,does a character think their sibling would make a great treasurer?,,Varian Johnson and Shannon Wright,Twins,OBOB Practice-Question Coalition
twins,in-which-book,81,do sisters both run for student council president?,,Varian Johnson and Shannon Wright,Twins,OBOB Practice-Question Coalition
twins,in-which-book,81,do two siblings both run for the same seat on the student council?,,Varian Johnson and Shannon Wright,Twins,OBOB Practice-Question Coalition
twins,in-which-book,86,"is there a store called ""Mercy Danger"" at the mall?",,Varian Johnson and Shannon Wright,Twins,OBOB Practice-Question Coalition
twins,in-which-book,86,"is there a store called ""mercy danger""?",,Varian Johnson and Shannon Wright,Twins,Beaverton City Library
twins,in-which-book,94,is a character’s favorite restaurant The Wonderful World of Waffles?,,Varian Johnson and Shannon Wright,Twins,Lake Oswego Library
twins,in-which-book,94,does a family eat at the Wonderful World of Waffles?,,Varian Johnson and Shannon Wright,Twins,OBOB Practice-Question Coalition
twins,in-which-book,94,is someone's favorite restaurant the wonderful world of waffles?,,Varian Johnson and Shannon Wright,Twins,Beaverton City Library
twins,in-which-book,100,does a character receive extra credit in social studies for helping out on a campaign?,,Varian Johnson and Shannon Wright,Twins,OBOB Practice-Question Coalition
twins,in-which-book,107,"does a character ask, ""What type of sister runs against her own flesh and blood?""",,Varian Johnson and Shannon Wright,Twins,OBOB Practice-Question Coalition
twins,in-which-book,111,do parents think a little competition may be good for their children?,,Varian Johnson and Shannon Wright,Twins,OBOB Practice-Question Coalition
twins,in-which-book,111,is a character tired of competing with their sibling?,,Varian Johnson and Shannon Wright,Twins,OBOB Practice-Question Coalition
twins,in-which-book,115,"do parents explain a new plan at dinner, that siblings will live in separate rooms for two weeks.?",,Varian Johnson and Shannon Wright,Twins,OBOB Practice-Question Coalition
twins,in-which-book,115,do siblings have to live in separate rooms during an election season?,,Varian Johnson and Shannon Wright,Twins,OBOB Practice-Question Coalition
twins,in-which-book,116,does a coin-flip determine which bedrooms two characters get to sleep in?,,Varian Johnson and Shannon Wright,Twins,Lake Oswego Library
twins,in-which-book,116,does someone stay in their half-brother's bedroom?,,Varian Johnson and Shannon Wright,Twins,Cedar Mill Library
twins,in-which-book,117,"does one sibling say to the other, ""Stop acting like we're getting divorced.""",,Varian Johnson and Shannon Wright,Twins,OBOB Practice-Question Coalition
twins,in-which-book,119,does a family stop at a roadside amusement park on their way to Florida?,,Varian Johnson and Shannon Wright,Twins,OBOB Practice-Question Coalition
twins,in-which-book,120,are there two teddy bears named Venus and Serena?,,Varian Johnson and Shannon Wright,Twins,Lake Oswego Library
twins,in-which-book,120,do characters have matching teddy bears named Venus and Serena?,,Varian Johnson and Shannon Wright,Twins,OBOB Practice-Question Coalition
twins,in-which-book,121,are there two stuffed bears named venus and serena?,,Varian Johnson and Shannon Wright,Twins,Beaverton City Library
twins,in-which-book,129,are students advised to study up on chapter one as their is always military history on the first exam?,,Varian Johnson and Shannon Wright,Twins,OBOB Practice-Question Coalition
twins,in-which-book,130,is there a dance scheduled in October?,,Varian Johnson and Shannon Wright,Twins,OBOB Practice-Question Coalition
twins,in-which-book,131,does a character think that sixth graders should be buddied up with older students at the beginning of middle school?,,Varian Johnson and Shannon Wright,Twins,Lake Oswego Library
twins,in-which-book,132,is a buddy system a platform?,,Varian Johnson and Shannon Wright,Twins,OBOB Practice-Question Coalition
twins,in-which-book,138,"is it said, ""Nothing gets votes like a girl in uniform.""?",,Varian Johnson and Shannon Wright,Twins,OBOB Practice-Question Coalition
twins,in-which-book,139,"does a character say to another character, ""Loosen up, I've seen frozen fish sticks with more personality.""?",,Varian Johnson and Shannon Wright,Twins,OBOB Practice-Question Coalition
twins,in-which-book,145,"does an adult say ""A ""B"" isn't the worst grade in the world""?",,Varian Johnson and Shannon Wright,Twins,OBOB Practice-Question Coalition
twins,in-which-book,149,"does a poster get marked with insults including ""barf face"" and ""gross""?",,Varian Johnson and Shannon Wright,Twins,OBOB Practice-Question Coalition
twins,in-which-book,149,"was someone called ""barf face""?",,Varian Johnson and Shannon Wright,Twins,Beaverton City Library
twins,in-which-book,151,does a character have to read her winning Earth Day essay in front of the school?,,Varian Johnson and Shannon Wright,Twins,OBOB Practice-Question Coalition
twins,in-which-book,157,"does a character say, ""You promised -- no dirty polititics.""?",,Varian Johnson and Shannon Wright,Twins,OBOB Practice-Question Coalition
twins,in-which-book,160,does a character tell someone else’s secret to someone in their gym class?,,Varian Johnson and Shannon Wright,Twins,Lake Oswego Library
twins,in-which-book,164,do parents ground their child indefinitely?,,Varian Johnson and Shannon Wright,Twins,OBOB Practice-Question Coalition
twins,in-which-book,164,"does a character get ""grounded indefinitely"" for telling a secret?",,Varian Johnson and Shannon Wright,Twins,OBOB Practice-Question Coalition
twins,in-which-book,173,does a brother want to meet his sisters' friends to give them a stamp of approval?,,Varian Johnson and Shannon Wright,Twins,OBOB Practice-Question Coalition
twins,in-which-book,174,does a brother and sister have a conversation while doing the dinner dishes together?,,Varian Johnson and Shannon Wright,Twins,OBOB Practice-Question Coalition
twins,in-which-book,180,is a character's student council platform about more interaction between clubs at school?,,Varian Johnson and Shannon Wright,Twins,OBOB Practice-Question Coalition
twins,in-which-book,182,does a character have to do push-ups because they were drawing in class?,,Varian Johnson and Shannon Wright,Twins,OBOB Practice-Question Coalition
twins,in-which-book,183,"does a teacher say, ""You haven't finished those push-ups yet?! My nana would be done by now, and she's dead!!""?",,Varian Johnson and Shannon Wright,Twins,OBOB Practice-Question Coalition
twins,in-which-book,184,"does a student say, ""Would you ask Picasso to stop drawing? Or Mozart to stop composing?""",,Varian Johnson and Shannon Wright,Twins,OBOB Practice-Question Coalition
twins,in-which-book,186,"does a student say, ""Cadet Garcia, is your spine made of mashed potatoes?""",,Varian Johnson and Shannon Wright,Twins,OBOB Practice-Question Coalition
twins,in-which-book,191,"does someone say they'd ""like to have a civil conversation about the election""?",,Varian Johnson and Shannon Wright,Twins,OBOB Practice-Question Coalition
twins,in-which-book,202,does a friend help resolve a sibling rivalry?,,Varian Johnson and Shannon Wright,Twins,OBOB Practice-Question Coalition
twins,in-which-book,219,"does someone say, ""There I was, finally good at something. And they didn't even know it was me.""",,Varian Johnson and Shannon Wright,Twins,OBOB Practice-Question Coalition
twins,in-which-book,225,do characters choose practicing their speeches instead of going to a sleepover?,,Varian Johnson and Shannon Wright,Twins,OBOB Practice-Question Coalition
twins,in-which-book,240,is there a close out sale in the mall?,,Varian Johnson and Shannon Wright,Twins,OBOB Practice-Question Coalition
twins,in-which-book,243,do seven friends go to a school dance?,,Varian Johnson and Shannon Wright,Twins,OBOB Practice-Question Coalition
twins,in-which-book,245,does a character join Color Guard?,,Varian Johnson and Shannon Wright,Twins,Lake Oswego Library
twins,in-which-book,245,does someone join Color Guard?,,Varian Johnson and Shannon Wright,Twins,Cedar Mill Library
twins,in-which-book,245,does a character decide to join color guard?,,Varian Johnson and Shannon Wright,Twins,OBOB Practice-Question Coalition
twins,in-which-book,246,"does a character join Color Guard, which gives her extra credit points?",,Varian Johnson and Shannon Wright,Twins,OBOB Practice-Question Coalition
twins,in-which-book,248,"are the last three words of the book ""And Just Dance!""?",,Varian Johnson and Shannon Wright,Twins,OBOB Practice-Question Coalition