book_key,question_type,page,text,answer,author_name,book_title,source_name
finding-langston,content,28,"who is the library named after, in their honor, that Langston goes to in Chicago?",George Cleveland Hall,Lesa Cline-Ransome,Finding Langston,OBOB Parent Group
finding-langston,content,29,how many years ago was the Chicago library branch built that Langston visits?,fifteen years ago,Lesa Cline-Ransome,Finding Langston,OBOB Parent Group
finding-langston,content,29,who is the adult librarian that Langston met?,Mrs. Kimble,Lesa Cline-Ransome,Finding Langston,OBOB Parent Group
finding-langston,content,29,who is the children's librarian that helps Langston with his selections at the library?,Miss Cook,Lesa Cline-Ransome,Finding Langston,OBOB Parent Group
finding-langston,content,30,what two things does Langston need to borrow any books he wants? (2-part),name and address,Lesa Cline-Ransome,Finding Langston,OBOB Parent Group
finding-langston,content,30,what is Langston's address number on Wabash?,4501,Lesa Cline-Ransome,Finding Langston,OBOB Parent Group
finding-langston,content,30,what is Langston and his father's last stop while running errands?,Fish Market,Lesa Cline-Ransome,Finding Langston,Lake Oswego Public Library
finding-langston,content,31,who asked Langston if he was named after Langston Hughes?,Miss Cook,Lesa Cline-Ransome,Finding Langston,OBOB Parent Group
finding-langston,content,31,who does Miss Cook ask Langston if he was named after?,Langston Hughes,Lesa Cline-Ransome,Finding Langston,OBOB Parent Group
finding-langston,content,31,what color is the envelope with Langston's library card inside?,yellow,Lesa Cline-Ransome,Finding Langston,OBOB Parent Group
finding-langston,content,31,when are Langston's library books due back?,two weeks,Lesa Cline-Ransome,Finding Langston,OBOB Parent Group
finding-langston,content,31,how many books can Langston take out at a time from the library?,five,Lesa Cline-Ransome,Finding Langston,OBOB Parent Group
finding-langston,content,31,how many books is Lagston allowed to check out from the library?,5,Lesa Cline-Ransome,Finding Langston,Lake Oswego Public Library
finding-langston,content,32,what does Langston think Langston Hughes seems like more than a poet?,magician,Lesa Cline-Ransome,Finding Langston,OBOB Parent Group
finding-langston,content,32,who is the owner of the market at the corner?,Mr. Fields,Lesa Cline-Ransome,Finding Langston,OBOB Parent Group
finding-langston,content,32,what is the name of the grocery store owner?,Mr. Fields,Lesa Cline-Ransome,Finding Langston,Lake Oswego Public Library
finding-langston,content,33,what specific foods does Langston miss that his Mama makes rather than the overcooked chicken he is eating?  Name two.  (2-part),"neck bones, gravy, cornbread",Lesa Cline-Ransome,Finding Langston,OBOB Parent Group
finding-langston,content,33,who named Langston?,Mama,Lesa Cline-Ransome,Finding Langston,OBOB Parent Group
finding-langston,content,33,what does Langston's Daddy wish Langston had been named?,Henry Junior,Lesa Cline-Ransome,Finding Langston,OBOB Parent Group
finding-langston,content,34,what day does Langston and his daddy run errands?,Saturday,Lesa Cline-Ransome,Finding Langston,OBOB Parent Group
finding-langston,content,34,what floor of the apartment is the smell of eggs and bacon frying making Langston's stomach growl?,2nd floor,Lesa Cline-Ransome,Finding Langston,OBOB Parent Group
finding-langston,content,34,On a Saturday what does Langston wish was in his mind and nothing else?  (2-part),friends and marbles,Lesa Cline-Ransome,Finding Langston,OBOB Parent Group
finding-langston,content,34,when Langston cuts through the alley off of Wabash what street does he come to?,Indiana,Lesa Cline-Ransome,Finding Langston,OBOB Parent Group
finding-langston,content,35,Who does Langston's dad mail money back home to?,Aunt Lena,Lesa Cline-Ransome,Finding Langston,OBOB Parent Group
finding-langston,content,35,how many girls does Aunt Lena have?,three,Lesa Cline-Ransome,Finding Langston,OBOB Parent Group
finding-langston,content,36,what day was Mama's wash day?,Saturday,Lesa Cline-Ransome,Finding Langston,OBOB Parent Group
finding-langston,content,36,what does daddy like to eat on Saturday's?,fish,Lesa Cline-Ransome,Finding Langston,OBOB Parent Group
finding-langston,content,37,what does Langston's mom boil on the stove to get rid of the fish smell?,vinegar,Lesa Cline-Ransome,Finding Langston,OBOB Parent Group
finding-langston,content,37,what does daddy buy at the fish market with the head and tails on?,porgies,Lesa Cline-Ransome,Finding Langston,OBOB Parent Group
finding-langston,content,37,what word was called out when Langston and his daddy ordered from the fish market?,country,Lesa Cline-Ransome,Finding Langston,OBOB Parent Group
finding-langston,content,38,who does Langston's dad tell that Langston would be happy to help with their cart?,Miss Fulton,Lesa Cline-Ransome,Finding Langston,OBOB Parent Group
finding-langston,content,38,who's smile was different for Langston than the one given to his daddy?,Miss Fulton,Lesa Cline-Ransome,Finding Langston,OBOB Parent Group
finding-langston,content,38,what exact word does Langston use that his apartment sounds like on a Saturday night?,honky-tonk,Lesa Cline-Ransome,Finding Langston,OBOB Parent Group
finding-langston,content,38,what is Langston's dad's first name?,Henry,Lesa Cline-Ransome,Finding Langston,Lake Oswego Public Library
finding-langston,content,39,where did Langston go every Sunday morning?,church,Lesa Cline-Ransome,Finding Langston,OBOB Parent Group
finding-langston,content,39,what was on the sign painted outside of the church?,Praise Tabernacle,Lesa Cline-Ransome,Finding Langston,OBOB Parent Group
finding-langston,content,39,what proverbs does Langston read with his daddy's bible?,3:5,Lesa Cline-Ransome,Finding Langston,OBOB Parent Group
finding-langston,content,41,when Langston walks with his daddy in the morning for school which way does he turn at the end of the block?,right,Lesa Cline-Ransome,Finding Langston,OBOB Parent Group
finding-langston,content,41,when Langston's daddy asks to work in the morning which way does he turn at the end of the block?,left,Lesa Cline-Ransome,Finding Langston,OBOB Parent Group
finding-langston,content,41,how many pennies does Langston find that fell out of daddy's pocket while looking for his key?,four,Lesa Cline-Ransome,Finding Langston,OBOB Parent Group
finding-langston,content,41,what does Langston find in a crack between the floorboards?,his key,Lesa Cline-Ransome,Finding Langston,OBOB Parent Group
finding-langston,content,41,what does Langston find that belongs to him other than finding the four pennies and his key?,marble,Lesa Cline-Ransome,Finding Langston,OBOB Parent Group
finding-langston,content,41,what does Langston find pushed all the way in the corner under his bed?,shoebox,Lesa Cline-Ransome,Finding Langston,OBOB Parent Group
finding-langston,content,41,how many pennies fell out of Langston's dad's pocket?,Four,Lesa Cline-Ransome,Finding Langston,Lake Oswego Public Library
finding-langston,content,42,who wrote to Henry to tell them Langston's grandma is sick?,Lena,Lesa Cline-Ransome,Finding Langston,OBOB Parent Group
finding-langston,content,42,who would lay out dish after dish on their old lace tablecloth?,Langston's grandma,Lesa Cline-Ransome,Finding Langston,OBOB Parent Group
finding-langston,content,42,name two dishes Langston's grandma would serve after church for supper? (2-part),"ham, macaroni and cheese, fried okra, biscuits, green beans swimming in butter, sweet tea",Lesa Cline-Ransome,Finding Langston,OBOB Parent Group
finding-langston,content,42,what is the name of Langston's aunt?,Lena,Lesa Cline-Ransome,Finding Langston,Lake Oswego Public Library
finding-langston,content,43,what was brought out at Grandma's table on Sunday after Mama and Lena cleared the table?,pies,Lesa Cline-Ransome,Finding Langston,OBOB Parent Group
finding-langston,content,43,What did Langston's grandma treat his mom like when she was sick?,newborn baby,Lesa Cline-Ransome,Finding Langston,OBOB Parent Group
finding-langston,content,43,who's family passed when they were still young?,Langston's Mama,Lesa Cline-Ransome,Finding Langston,OBOB Parent Group
finding-langston,content,43,who is the principal at Langston's school?,Mr. Freeman,Lesa Cline-Ransome,Finding Langston,OBOB Parent Group
finding-langston,content,43,what color does Langston notice the leaves starting to turn on his walk to the library?,yellow,Lesa Cline-Ransome,Finding Langston,OBOB Parent Group
finding-langston,content,44,In the spring what smell made Mama smile?,white blossoms,Lesa Cline-Ransome,Finding Langston,OBOB Parent Group
finding-langston,content,44,what tree would Mama cut a few branches at first flower to put on the table in a mason jar filled with water?,white blossoms,Lesa Cline-Ransome,Finding Langston,OBOB Parent Group
finding-langston,content,44,what call number is Langston told to look at for books on trees?,580,Lesa Cline-Ransome,Finding Langston,OBOB Parent Group
finding-langston,content,44,what is the dewey decimal (call) number for trees?,580,Lesa Cline-Ransome,Finding Langston,Lake Oswego Public Library
finding-langston,content,45,what type of tree does Langston look through pictures in a book for?,magnolia tree,Lesa Cline-Ransome,Finding Langston,OBOB Parent Group
finding-langston,content,46,Mrs. Robins calls Langston in because he did not hear the bell.  How many minutes ago did it ring?,five,Lesa Cline-Ransome,Finding Langston,OBOB Parent Group
finding-langston,content,47,who tells Langston that he was scared to come back in from recess?,Lymon,Lesa Cline-Ransome,Finding Langston,OBOB Parent Group
finding-langston,content,47,what page in the history textbook does Mrs. Robins tell the kids to turn to?,65,Lesa Cline-Ransome,Finding Langston,OBOB Parent Group
finding-langston,content,47,who's face does Langston yell into to leave him alone?,Lymon,Lesa Cline-Ransome,Finding Langston,OBOB Parent Group
finding-langston,content,47,what page does Mrs. Robins tell them to open their history books to?,Page 65,Lesa Cline-Ransome,Finding Langston,Lake Oswego Public Library
finding-langston,content,48,who first notices what happened to Langston's lip once he left school?,Miss Fulton,Lesa Cline-Ransome,Finding Langston,OBOB Parent Group
finding-langston,content,49,what is in the greasy sack that Langston's dad puts on the table after talking to Miss Fulton in the hall?,chicken,Lesa Cline-Ransome,Finding Langston,OBOB Parent Group
finding-langston,content,51,what color is the handkerchief that Langston's daddy takes from his pocket?,gray,Lesa Cline-Ransome,Finding Langston,OBOB Parent Group
finding-langston,content,51,who does Langston's daddy fall into debt with in Alabama?,Mr. Clanton,Lesa Cline-Ransome,Finding Langston,OBOB Parent Group
finding-langston,content,54,what is Miss Fulton's first name?,Pearl,Lesa Cline-Ransome,Finding Langston,OBOB Parent Group
finding-langston,content,54,what type of dessert did Miss Fulton make and bring to Langston and daddy to share?,apple pie,Lesa Cline-Ransome,Finding Langston,OBOB Parent Group
finding-langston,content,54,who's teeth are so white and pretty that they could light up a room?,Miss Fulton,Lesa Cline-Ransome,Finding Langston,OBOB Parent Group
finding-langston,content,55,where does Langston's daddy work?,Maxwell Brothers plant,Lesa Cline-Ransome,Finding Langston,OBOB Parent Group
finding-langston,content,55,what is the name of the plant his father works at?,Maxwell Brothers,Lesa Cline-Ransome,Finding Langston,Lake Oswego Public Library
finding-langston,content,56,who puts aside books they think Langston will like?,Miss Cook,Lesa Cline-Ransome,Finding Langston,OBOB Parent Group
finding-langston,content,56,who tells Langston here is another from your namesake?,Miss Cook,Lesa Cline-Ransome,Finding Langston,OBOB Parent Group
finding-langston,content,56,what poem on Langston Hughes has to do with mud?,Red Clay Blues,Lesa Cline-Ransome,Finding Langston,OBOB Parent Group
finding-langston,content,57,who does Langston ask if Langston Hughes is from Alabama?,Miss Cook,Lesa Cline-Ransome,Finding Langston,OBOB Parent Group
finding-langston,content,57,what does Langston learn is a genre that is like a story about someone's life?,biography,Lesa Cline-Ransome,Finding Langston,OBOB Parent Group
finding-langston,content,57,who tells Langston something happened and he has to go?,Daddy,Lesa Cline-Ransome,Finding Langston,OBOB Parent Group
finding-langston,content,58,who looks in on Langston when his daddy goes back to Alabama?,Miss Fulton or Pearl,Lesa Cline-Ransome,Finding Langston,OBOB Parent Group
finding-langston,content,58,What happened that Langston's daddy go back to Alabama without him?,Grandma died,Lesa Cline-Ransome,Finding Langston,OBOB Parent Group
finding-langston,content,58,where is Langston sent by his grandma the last morning he saw his Mama alive?,school,Lesa Cline-Ransome,Finding Langston,OBOB Parent Group
finding-langston,content,58,the day Langston's mom died who did he see coming down the steps with his daddy and grandma?,Pastor Lawson,Lesa Cline-Ransome,Finding Langston,OBOB Parent Group
finding-langston,content,59,what type of plant does Langston's daddy work at?,paper,Lesa Cline-Ransome,Finding Langston,OBOB Parent Group
finding-langston,content,59,who does Langston say will never get a chance to see Chicago?,grandma,Lesa Cline-Ransome,Finding Langston,OBOB Parent Group
finding-langston,content,59,what type of smell does Langston's daddy's shirt smell like from the plant?,sour,Lesa Cline-Ransome,Finding Langston,OBOB Parent Group
finding-langston,content,59,who steps into Langston's apartment without being invited?,Miss Fulton,Lesa Cline-Ransome,Finding Langston,OBOB Parent Group
finding-langston,content,60,what did Miss Fulton make for Langston the first night his dad left for Alabama?  Name two. (2-part),"pork chops, green beans, cornbread",Lesa Cline-Ransome,Finding Langston,OBOB Parent Group
finding-langston,content,61,what is the title of the Langston Hughes biography?,The Big Sea,Lesa Cline-Ransome,Finding Langston,OBOB Parent Group
finding-langston,content,61,who has shiny wavy hair like the ladies that come out of the beauty parlor on Saturdays?,Langston Hughes,Lesa Cline-Ransome,Finding Langston,OBOB Parent Group
finding-langston,content,62,what does Langston's mom call her writing with big and little loops?,my fancy writing,Lesa Cline-Ransome,Finding Langston,OBOB Parent Group
finding-langston,content,62,"who wrote the poem 'My black one, Thou art not beautiful, Yet Thou hast, A loveliness, Surpassing beauty'?",Langston's Mama,Lesa Cline-Ransome,Finding Langston,OBOB Parent Group
finding-langston,content,63,when Langston burned the last two piecase of toast what was he left to eat for breakfast? (2-part),"crackers, nasty shriveled-up apple",Lesa Cline-Ransome,Finding Langston,OBOB Parent Group
finding-langston,content,63,what two places in Langston Hughes from? (2-part),"Missouri, Kansas",Lesa Cline-Ransome,Finding Langston,OBOB Parent Group
finding-langston,content,63,What city did Langston Hughes go to college?  What part of town did he love living in? (2-part),"New York, Harlem",Lesa Cline-Ransome,Finding Langston,OBOB Parent Group
finding-langston,content,64,who is standing talking to Miss Cook and Langston feels like he was followed?,Clem,Lesa Cline-Ransome,Finding Langston,OBOB Parent Group
finding-langston,content,65,what day of the week does Clem come to the library when his mama is working late?,Thursday's,Lesa Cline-Ransome,Finding Langston,OBOB Parent Group
finding-langston,content,66,who are the first two pictures on the wall of the library of black women writers that Langston sees? (2-part),"Margaret Walker, Gwendolyn Brooks",Lesa Cline-Ransome,Finding Langston,OBOB Parent Group
finding-langston,content,66,who are other black male writers that Langston sees pictures of on the wall? (2-part),"Richard Wright, Arna Bontemps",Lesa Cline-Ransome,Finding Langston,OBOB Parent Group
finding-langston,content,66,who is the first person that Langston realized he yelled at?,Clem,Lesa Cline-Ransome,Finding Langston,OBOB Parent Group
finding-langston,content,67,what earring does Langston notice on Miss Fulton like rich ladies wear?,pearl,Lesa Cline-Ransome,Finding Langston,OBOB Parent Group
finding-langston,content,67,who didn't even have their ears pierced and wouldn't waste money on earrings?,Langston's mama,Lesa Cline-Ransome,Finding Langston,OBOB Parent Group
finding-langston,content,67,what subject does Miss Fulton teach?,English,Lesa Cline-Ransome,Finding Langston,OBOB Parent Group
finding-langston,content,67,what high school does Miss Fulton teach at?,Dunbar High School,Lesa Cline-Ransome,Finding Langston,OBOB Parent Group
finding-langston,content,67,how many sisters does Miss Fulton have?  How many brothers? (2-part),"two sisters, one brother",Lesa Cline-Ransome,Finding Langston,OBOB Parent Group
finding-langston,content,67,what subject and at what school does Miss Fulton teach?,English and Dunbar High School,Lesa Cline-Ransome,Finding Langston,Lake Oswego Public Library
finding-langston,content,68,what are the first names of Miss Fulton's parents? (2-part),"Anne, Elbert",Lesa Cline-Ransome,Finding Langston,OBOB Parent Group
finding-langston,content,68,what city and state did Miss Fulton's parents move from? (2-part),"Charlottesville, Virginia",Lesa Cline-Ransome,Finding Langston,OBOB Parent Group
finding-langston,content,68,what two cross streets do Miss Fulton's parents live on?,Forty-Fifth and St. Lawrence,Lesa Cline-Ransome,Finding Langston,OBOB Parent Group
finding-langston,content,68,what is Miss Fulton's brother name and where does he live? (2-part),"William, Indiana",Lesa Cline-Ransome,Finding Langston,OBOB Parent Group
finding-langston,content,68,what college does one of Miss Fulton's sisters go to on the west side?,Crane College,Lesa Cline-Ransome,Finding Langston,OBOB Parent Group
finding-langston,content,68,how many years has Miss Fulton been teaching?,10 years,Lesa Cline-Ransome,Finding Langston,OBOB Parent Group
finding-langston,content,69,how many years until Langston is in high school?,two,Lesa Cline-Ransome,Finding Langston,OBOB Parent Group
finding-langston,content,69,what are someone of the magazines in Miss Fulton's apartment?  Name two. (2-part),"Life, The Crisis, Ebony",Lesa Cline-Ransome,Finding Langston,OBOB Parent Group
finding-langston,content,69,what does Miss Fulton smell like?,lavender,Lesa Cline-Ransome,Finding Langston,OBOB Parent Group
finding-langston,content,69,Name two of the classic poets Miss Fulton mentions she teaches?,"Emerson, Frost, Dickinson",Lesa Cline-Ransome,Finding Langston,OBOB Parent Group
finding-langston,content,69,what black poet does Miss Fulton first mention?,Paul Laurence Dunbar,Lesa Cline-Ransome,Finding Langston,OBOB Parent Group
finding-langston,content,69,where does Miss Fulton say many of the poets are from?,Harlem Renaissance,Lesa Cline-Ransome,Finding Langston,OBOB Parent Group
finding-langston,content,70,what names does Langston recognize from Miss Fulton's list from the pictures at the library other than Langston Hughes? Name two. (2-part),"Arna Bontemps, Gwendolyn Brooks",Lesa Cline-Ransome,Finding Langston,OBOB Parent Group
finding-langston,content,70,what names from Miss Fulton's list does Langston not recognize of black poets?,"Countee Cullen, W.E.B. Du Bois, Jessie Fauset,",Lesa Cline-Ransome,Finding Langston,OBOB Parent Group
finding-langston,content,70,what library did Miss Fulton hear Langston Hughes read his poetry at?,Hall Library,Lesa Cline-Ransome,Finding Langston,OBOB Parent Group
finding-langston,content,71,when Langston's mama passed his grandma told him that mama was always going to be this?,guardian angel,Lesa Cline-Ransome,Finding Langston,OBOB Parent Group
finding-langston,content,73,who in Langston's class wears clothes that always looks two sizes too small?,Ruby,Lesa Cline-Ransome,Finding Langston,OBOB Parent Group
finding-langston,content,73,who sits behind Langston and can't stop talking?,Ruby,Lesa Cline-Ransome,Finding Langston,OBOB Parent Group
finding-langston,content,73,who does Mrs. Robins tell 'I'm the only one speaking now!'?,Ruby,Lesa Cline-Ransome,Finding Langston,OBOB Parent Group
finding-langston,content,73,whose clothes always looked two sizes too small?,Ruby,Lesa Cline-Ransome,Finding Langston,Lake Oswego Public Library
finding-langston,content,74,what does Clem's Mama do for work?,keeps house,Lesa Cline-Ransome,Finding Langston,OBOB Parent Group
finding-langston,content,74,what family does Clem's mama keep house for?,Franklin family,Lesa Cline-Ransome,Finding Langston,OBOB Parent Group
finding-langston,content,74,where does the Franklin family live?,Hyde Park,Lesa Cline-Ransome,Finding Langston,OBOB Parent Group
finding-langston,content,74,who does Langston think you can't see nothing but teeth when they smile?,Clem,Lesa Cline-Ransome,Finding Langston,OBOB Parent Group
finding-langston,content,75,who does Langston ask what king of books another is reading?,Clem,Lesa Cline-Ransome,Finding Langston,OBOB Parent Group
finding-langston,content,75,what does Clem want to do for work one day?,Navy,Lesa Cline-Ransome,Finding Langston,OBOB Parent Group
finding-langston,content,76,what section is the poetry in at the library?,800,Lesa Cline-Ransome,Finding Langston,OBOB Parent Group
finding-langston,content,76,what are the words on the cover of the poetry book Miss Fulton had of black poets?,Caroling Dusk,Lesa Cline-Ransome,Finding Langston,OBOB Parent Group
finding-langston,content,76,what is the name for the numbered sections at the library?,call numbers,Lesa Cline-Ransome,Finding Langston,OBOB Parent Group
finding-langston,content,77,who is sitting at the table when Langston realizes his daddy is back from Alabama?,Miss Fulton,Lesa Cline-Ransome,Finding Langston,OBOB Parent Group
finding-langston,content,79,who told Langston there is no shame in being a reader and loving poetry?,Miss Fulton,Lesa Cline-Ransome,Finding Langston,OBOB Parent Group
finding-langston,content,80,after Langston sees Lyman is back how many hours is he not listening for until lunch?,three hours,Lesa Cline-Ransome,Finding Langston,OBOB Parent Group
finding-langston,content,80,what is a collection of poems called?,anthology,Lesa Cline-Ransome,Finding Langston,OBOB Parent Group
finding-langston,content,80,"Langston made a promise to read every Langston Hughes book they have in the library, which book does he start with?",The Weary Blues,Lesa Cline-Ransome,Finding Langston,OBOB Parent Group
finding-langston,content,80,"who said the blues makes you feel the hurt deep down in your gut, and the blues is about how much colored folks go through in life and love?",Mama,Lesa Cline-Ransome,Finding Langston,OBOB Parent Group
finding-langston,content,80,what is the first title Langston flips to in The Weary Blues?,Poem 4: To the Black Beloved,Lesa Cline-Ransome,Finding Langston,OBOB Parent Group
finding-langston,content,80,"in The Weary Blues by Langston Hughes, what is the title of Poem 4?",To the Black Beloved,Lesa Cline-Ransome,Finding Langston,Lake Oswego Public Library
finding-langston,content,81,what is the second poem that Langston turns the page to after reading Poem 4: To the Black Beloved?,Harlem Night Club,Lesa Cline-Ransome,Finding Langston,OBOB Parent Group
finding-langston,content,81,who pushes Langston into a fence?,Errol,Lesa Cline-Ransome,Finding Langston,OBOB Parent Group
finding-langston,content,82,who rips out pages in Langston's book and throws them into the air?,Lymon,Lesa Cline-Ransome,Finding Langston,OBOB Parent Group
finding-langston,content,82,who tells Lymon they can barely read?,Langston,Lesa Cline-Ransome,Finding Langston,OBOB Parent Group
finding-langston,content,83,when Langston thinks kids usually scream and yell when witnessing a fight who's match is Langston referring to?,Joe Louis,Lesa Cline-Ransome,Finding Langston,OBOB Parent Group
finding-langston,content,85,what street is the Hall Branch Library on?,Michigan,Lesa Cline-Ransome,Finding Langston,OBOB Parent Group
finding-langston,content,85,what is the first book that Langston hands his daddy?,Weary Blues,Lesa Cline-Ransome,Finding Langston,OBOB Parent Group
finding-langston,content,87,who does Langston's daddy say that their head was always in a book?,Mama,Lesa Cline-Ransome,Finding Langston,OBOB Parent Group
finding-langston,content,87,"who was Langston's Mama's Aunt who checked on her after her parents passed, and where did she live? (2-part)","Genevieve or Aunt Gennie, Ohio",Lesa Cline-Ransome,Finding Langston,OBOB Parent Group
finding-langston,content,88,The first time Langston's daddy saw his Mama what was she doing?,reading,Lesa Cline-Ransome,Finding Langston,OBOB Parent Group
finding-langston,content,89,what does Langston and Lymon have to do after school because of their fight?,detention,Lesa Cline-Ransome,Finding Langston,OBOB Parent Group
finding-langston,content,89,what does Langston worry will be taken away after his fight?,library card,Lesa Cline-Ransome,Finding Langston,OBOB Parent Group
finding-langston,content,89,what does Langston not hear in the school yard for the first time since he started school in Chicago?,country boy,Lesa Cline-Ransome,Finding Langston,OBOB Parent Group
finding-langston,content,90,how long is detention?,one hour,Lesa Cline-Ransome,Finding Langston,OBOB Parent Group
finding-langston,content,90,Langston says detention is not like library quiet it is like what?,jail quiet,Lesa Cline-Ransome,Finding Langston,OBOB Parent Group
finding-langston,content,90,what does the corner store smell like? (2-part),cigarettes and mints,Lesa Cline-Ransome,Finding Langston,OBOB Parent Group
finding-langston,content,90,who is sitting on the stool in the corner store?,Mr. Jackson,Lesa Cline-Ransome,Finding Langston,OBOB Parent Group
