book_key,question_type,page,text,answer,author_name,book_title,source_name
the-million-dollar-race,content,3,How many times does Grant's chin skid on the track?,3,Matthew Ross Smith,The Million Dollar Race,OBOB.dog Community
the-million-dollar-race,content,3,what does Grant do during the Penn Relays?,He falls,Matthew Ross Smith,The Million Dollar Race,Beaverton City Library
the-million-dollar-race,content,4,How long does Grant want to stay on the track?,Till the human race and civilization die out and until squirrels rebuild,Matthew Ross Smith,The Million Dollar Race,OBOB.dog Community
the-million-dollar-race,content,5,"The producers of what show invited Grant to New York following the ""epic spill"" at the Penn Relays?",The Midnight Show! with Jaime Freeman,Matthew Ross Smith,The Million Dollar Race,OBOB Parent Group
the-million-dollar-race,content,5,what is the name of the talk show that wanted Grant on?,The Midnight Show! with Jaime Freeman,Matthew Ross Smith,The Million Dollar Race,Lake Oswego Public Library
the-million-dollar-race,content,5,How many views does Grant's epic spill have 6 weeks later?,8.4 million,Matthew Ross Smith,The Million Dollar Race,OBOB.dog Community
the-million-dollar-race,content,6,What exercises does Jay's mom do in their aboveground pool?,pool-lates,Matthew Ross Smith,The Million Dollar Race,OBOB Parent Group
the-million-dollar-race,content,7,What is Jay's idea for a summer project?,to make a reality show about Grant's family,Matthew Ross Smith,The Million Dollar Race,OBOB Parent Group
the-million-dollar-race,content,7,who first has the idea of making a reality TV show of the Falloon family?,Jay,Matthew Ross Smith,The Million Dollar Race,Beaverton City Library
the-million-dollar-race,content,8,What does Jay call the pool in his house?,An oversized dunk tank,Matthew Ross Smith,The Million Dollar Race,OBOB.dog Community
the-million-dollar-race,content,9,What is Mrs. Fa'atasi obsessed with?,seashells,Matthew Ross Smith,The Million Dollar Race,OBOB Parent Group
the-million-dollar-race,content,9,What is the name of Jay's older brother?,Tua,Matthew Ross Smith,The Million Dollar Race,OBOB Parent Group
the-million-dollar-race,content,9,What branch of the military is Tua enlisted in?,Marines,Matthew Ross Smith,The Million Dollar Race,OBOB Parent Group
the-million-dollar-race,content,9,who is obsessed with seashells?,Mrs. Faâ€™atasi OR Jayâ€™s mom.,Matthew Ross Smith,The Million Dollar Race,Cedar Mill Public Library
the-million-dollar-race,content,9,According to Grant where are the rights to open Cheez-Its without asking?,"Rights of a best friend, subsection 9, clause 4",Matthew Ross Smith,The Million Dollar Race,OBOB.dog Community
the-million-dollar-race,content,9,What cheese is the Cheez-Its made out of?,Parmesan,Matthew Ross Smith,The Million Dollar Race,OBOB.dog Community
the-million-dollar-race,content,10,What name does Jay suggest for the hypothetical confessional documentary of Grant's family?,Last Family On Earth,Matthew Ross Smith,The Million Dollar Race,OBOB Parent Group
the-million-dollar-race,content,12,What is the name of the grocery store where Grant's family shops?,Food Palace,Matthew Ross Smith,The Million Dollar Race,OBOB Parent Group
the-million-dollar-race,content,12,What is Grant's younger sibling's name?,Franny or Francis (pg 22),Matthew Ross Smith,The Million Dollar Race,OBOB Parent Group
the-million-dollar-race,content,13,What does Grant's famiy do on Sundays instead of going to church?,ride their bikes to Food Palace to shop,Matthew Ross Smith,The Million Dollar Race,OBOB Parent Group
the-million-dollar-race,content,13,"Who said the books are just ""really long twitter threads u scroll sideways instead of down""?",Jay,Matthew Ross Smith,The Million Dollar Race,OBOB Parent Group
the-million-dollar-race,content,13,How many family members are in the Fallon family?,5,Matthew Ross Smith,The Million Dollar Race,OBOB.dog Community
the-million-dollar-race,content,14,What is Grant's mom's job?,public defender,Matthew Ross Smith,The Million Dollar Race,OBOB Parent Group
the-million-dollar-race,content,14,what year was Grantâ€™s dad born?,1986,Matthew Ross Smith,The Million Dollar Race,Lake Oswego Public Library
the-million-dollar-race,content,17,How old can kids be to enter the Million Dollar Race?,11-13 years old,Matthew Ross Smith,The Million Dollar Race,OBOB Parent Group
the-million-dollar-race,content,17,"what are the 2 things that the winners of ""Million Dollar Race"" will receive?",A trust fund worth one million dollars and a lifetime sponsorship deal from Babblemoney Sneaker Company,Matthew Ross Smith,The Million Dollar Race,Beaverton City Library
the-million-dollar-race,content,18,What is Esther Babblemoney's nickname?,Sneaker Queen,Matthew Ross Smith,The Million Dollar Race,OBOB Parent Group
the-million-dollar-race,content,18,Who is sponsoring the Million Dollar Race?,Babblemoney Sneaker Company,Matthew Ross Smith,The Million Dollar Race,OBOB Parent Group
the-million-dollar-race,content,18,"Who is the ""so-called Sneaker Queen worth over $50 billion.""?",Esther Babblemoney,Matthew Ross Smith,The Million Dollar Race,OBOB Parent Group
the-million-dollar-race,content,18,on what date would the local qualifier be held?,July 7,Matthew Ross Smith,The Million Dollar Race,Lake Oswego Public Library
the-million-dollar-race,content,18,As Babblemoney has been getting older she has been thinking about what more?,Her childhood,Matthew Ross Smith,The Million Dollar Race,OBOB.dog Community
the-million-dollar-race,content,18,When will finals be held for the million dollar race?,August 12,Matthew Ross Smith,The Million Dollar Race,OBOB.dog Community
the-million-dollar-race,content,18,Where will the finals of the million dollar race be held?,The famed Babblemoney estate,Matthew Ross Smith,The Million Dollar Race,OBOB.dog Community
the-million-dollar-race,content,20,What is the name of Franny's YouTube channel?,The Franny Files,Matthew Ross Smith,The Million Dollar Race,OBOB Parent Group
the-million-dollar-race,content,23,"What does the Falloon family motto ""Skepsis"" mean?",question everything,Matthew Ross Smith,The Million Dollar Race,OBOB Parent Group
the-million-dollar-race,content,23,What is the Falloon family motto?,Skepsis,Matthew Ross Smith,The Million Dollar Race,OBOB Parent Group
the-million-dollar-race,content,23,"what does the Greek word ""Skepsis"" mean?",Question Everything,Matthew Ross Smith,The Million Dollar Race,Beaverton City Library
the-million-dollar-race,content,27,Where do Jay and Grant train together?,Middle School Track,Matthew Ross Smith,The Million Dollar Race,OBOB Parent Group
the-million-dollar-race,content,28,What is the name of Jay and Grant's unofficial sponsor?,Frank's Pizza,Matthew Ross Smith,The Million Dollar Race,OBOB Parent Group
the-million-dollar-race,content,28,Where do Jay and Grant go for lunch after they stop training?,Frank's Pizza,Matthew Ross Smith,The Million Dollar Race,OBOB Parent Group
the-million-dollar-race,content,28,What year was Frank's Pizza opened?,1979,Matthew Ross Smith,The Million Dollar Race,OBOB Parent Group
the-million-dollar-race,content,30,"according to Grantâ€™s dad, what is the number of chews per bite to ensure maximum nutrient absorption?",Twenty,Matthew Ross Smith,The Million Dollar Race,Lake Oswego Public Library
the-million-dollar-race,content,32,What are the names of Grant's parents?,Dave and Diane Falloon,Matthew Ross Smith,The Million Dollar Race,OBOB Parent Group
the-million-dollar-race,content,33,Which network is making a documentary about the Million Dollar Race?,ESPN,Matthew Ross Smith,The Million Dollar Race,OBOB Parent Group
the-million-dollar-race,content,34,What word does Grant use to describe a group of security guards?,flex,Matthew Ross Smith,The Million Dollar Race,OBOB Parent Group
the-million-dollar-race,content,35,What does Esther Babblemoney wear to the track meets?,red tracksuit and pearls,Matthew Ross Smith,The Million Dollar Race,OBOB Parent Group
the-million-dollar-race,content,35,what does Grant call a group of security guards?,A flex,Matthew Ross Smith,The Million Dollar Race,Beaverton City Library
the-million-dollar-race,content,37,What is the width in inches of one lane on a track?,42 inches,Matthew Ross Smith,The Million Dollar Race,OBOB Parent Group
the-million-dollar-race,content,37,"In Grant's first heat at the Regional qualifiers, what did the kid in the next lane wear?",a turtle costume,Matthew Ross Smith,The Million Dollar Race,OBOB Parent Group
the-million-dollar-race,content,37,"when Grant gets in the zone, his vision shrinks to exactly how many inches?",Forty-two,Matthew Ross Smith,The Million Dollar Race,Lake Oswego Public Library
the-million-dollar-race,content,39,Whose protest delayed the Grant's heat of the regional qualifier ?,Franny,Matthew Ross Smith,The Million Dollar Race,OBOB Parent Group
the-million-dollar-race,content,44,How did Grant manage to beat Jay in the regional qualifying race?,by leaning,Matthew Ross Smith,The Million Dollar Race,OBOB Parent Group
the-million-dollar-race,content,48,Who does Jay have a recurring dream about?,his brother (Tua),Matthew Ross Smith,The Million Dollar Race,OBOB Parent Group
the-million-dollar-race,content,48,What song did Grant have in his head for a month?,Baby shark,Matthew Ross Smith,The Million Dollar Race,OBOB.dog Community
the-million-dollar-race,content,49,What word does Grant use at family dinner to sum up the day he won the regional qualifier?,Relieved,Matthew Ross Smith,The Million Dollar Race,OBOB Parent Group
the-million-dollar-race,content,49,What single word does Grant's mom use to sum up the day Grant won the regional championship?,Proud,Matthew Ross Smith,The Million Dollar Race,OBOB Parent Group
the-million-dollar-race,content,51,what is the midway point between Jay and Grantâ€™s houses?,The fenced-in walking bridge,Matthew Ross Smith,The Million Dollar Race,Lake Oswego Public Library
the-million-dollar-race,content,52,What is Jay wearing when he meets Grant at the track the morning after the regional championship?,all-white running gear with neon-yellow sneakers,Matthew Ross Smith,The Million Dollar Race,OBOB Parent Group
the-million-dollar-race,content,53,what is Grantâ€™s favorite movie made by Franny?,Small Bladder Bill,Matthew Ross Smith,The Million Dollar Race,Lake Oswego Public Library
the-million-dollar-race,content,55,What age is Jay's mom celebrating at her birthday party?,40 years old,Matthew Ross Smith,The Million Dollar Race,OBOB Parent Group
the-million-dollar-race,content,56,What kind of car does Mrs. Fa'atasi drive?,Camry,Matthew Ross Smith,The Million Dollar Race,OBOB Parent Group
the-million-dollar-race,content,57,How fast did Jay run at regionals?,10.77 seconds,Matthew Ross Smith,The Million Dollar Race,OBOB Parent Group
the-million-dollar-race,content,57,How much did Grant beat Jay by at regionals?,a hundredth of a second,Matthew Ross Smith,The Million Dollar Race,OBOB Parent Group
the-million-dollar-race,content,57,where did Jay move from in fourth grade?,Hawaii,Matthew Ross Smith,The Million Dollar Race,Lake Oswego Public Library
the-million-dollar-race,content,57,what grade was Grant in when he first saw Jay?,Fourth,Matthew Ross Smith,The Million Dollar Race,Beaverton City Library
the-million-dollar-race,content,59,"What is ""pisupo""",corned beef,Matthew Ross Smith,The Million Dollar Race,OBOB Parent Group
the-million-dollar-race,content,59,"at the party, Grantâ€™s mom, dad and Franny were on the dance floor gyrating awkwardly to a song by what band?",Black Eyed Peas,Matthew Ross Smith,The Million Dollar Race,Lake Oswego Public Library
the-million-dollar-race,content,60,What is the big surprise at Mrs. Fa'atasi's birthday party?,Tua comes home (from Afghanistan),Matthew Ross Smith,The Million Dollar Race,OBOB Parent Group
the-million-dollar-race,content,62,What kind of dolls does Mr. Falloon make?,Dracula,Matthew Ross Smith,The Million Dollar Race,OBOB Parent Group
the-million-dollar-race,content,62,"what game did Jay and Tua start playing the day before Tua left, but didn't finish?",Monopoly,Matthew Ross Smith,The Million Dollar Race,Beaverton City Library
the-million-dollar-race,content,65,When was Grant born?,2008-09-14,Matthew Ross Smith,The Million Dollar Race,OBOB Parent Group
the-million-dollar-race,content,65,when is Grantâ€™s birthday?,"September 14, 2008",Matthew Ross Smith,The Million Dollar Race,Lake Oswego Public Library
the-million-dollar-race,content,66,what reason does Grantâ€™s mom give for leaving the compound?,They were tired of pooping in the woods,Matthew Ross Smith,The Million Dollar Race,Lake Oswego Public Library
the-million-dollar-race,content,66,how does Grant's Mom translate his dad's reason for leaving the commune in California?,We got tired of pooping in the woods,Matthew Ross Smith,The Million Dollar Race,Beaverton City Library
the-million-dollar-race,content,68,What document does Grant need to find in order to enter the National qualifier?,birth certificate,Matthew Ross Smith,The Million Dollar Race,OBOB Parent Group
the-million-dollar-race,content,68,What is Grant's dad's favorite question?,Why,Matthew Ross Smith,The Million Dollar Race,OBOB Parent Group
the-million-dollar-race,content,71,What does Grant want for his birthday when he's 6 years old?,Captain America action figure,Matthew Ross Smith,The Million Dollar Race,OBOB Parent Group
the-million-dollar-race,content,71,what does 6-year-old Grant want for his birthday?,Captain America Action figure (new),Matthew Ross Smith,The Million Dollar Race,Beaverton City Library
the-million-dollar-race,content,73,What was the name of the superhero Grant's dad made for Grant for his 6th birthday?,Non-Violent Man,Matthew Ross Smith,The Million Dollar Race,OBOB Parent Group
the-million-dollar-race,content,75,What was the bus called that Grant and his family took to New York for Nationals?,Discount Rider,Matthew Ross Smith,The Million Dollar Race,OBOB Parent Group
the-million-dollar-race,content,75,what is the name of the bus that Grant's family rides to New York?,Discount Rider,Matthew Ross Smith,The Million Dollar Race,Newberg Public Library
the-million-dollar-race,content,77,What form does Jay forge his parents' signature on?,image release form,Matthew Ross Smith,The Million Dollar Race,OBOB Parent Group
the-million-dollar-race,content,82,Who tells Grant that his birth certificate isn't a legally certified document?,lawyer,Matthew Ross Smith,The Million Dollar Race,OBOB Parent Group
the-million-dollar-race,content,83,Why did Grant get disqualified from competing at Nationals?,He didn't have a valid birth certificate,Matthew Ross Smith,The Million Dollar Race,OBOB Parent Group
the-million-dollar-race,content,83,What was the name of the witness on Grant's birth certificate?,Karl,Matthew Ross Smith,The Million Dollar Race,OBOB Parent Group
the-million-dollar-race,content,87,What does Grant do with his race spot when Esther Babblemoney doesn't let him compete?,gives it to Jay,Matthew Ross Smith,The Million Dollar Race,OBOB Parent Group
the-million-dollar-race,content,90,What country does Grant joke he can compete for after being disqualified from Nationals?,Honor slovakia,Matthew Ross Smith,The Million Dollar Race,OBOB Parent Group
the-million-dollar-race,content,92,Where does Jay's brother take him for celebratory pizza after he gets a spot at Nationals?,Lorenzo's on South Street,Matthew Ross Smith,The Million Dollar Race,OBOB Parent Group
the-million-dollar-race,content,92,what street is Lorenzoâ€™s located on?,South Street,Matthew Ross Smith,The Million Dollar Race,Lake Oswego Public Library
the-million-dollar-race,content,97,who has the original idea for Grant to represent his own country rather than the USA?,Franny,Matthew Ross Smith,The Million Dollar Race,Beaverton City Library
the-million-dollar-race,content,105,Where in the house is Grant when he is inspired to name his new country Grantsylvania?,his dad's studio,Matthew Ross Smith,The Million Dollar Race,OBOB Parent Group
the-million-dollar-race,content,106,Where is Grant when he comes up with the name of his country?,Dad's Dracula production studio,Matthew Ross Smith,The Million Dollar Race,OBOB Parent Group
the-million-dollar-race,content,108,What is the inspiration for the design on the Grantsylvania flag?,Dracula's fangs,Matthew Ross Smith,The Million Dollar Race,OBOB Parent Group
the-million-dollar-race,content,110,Why are there black umbrellas at the track when Grant arrives?,Jay is in a photo shoot for ESPN,Matthew Ross Smith,The Million Dollar Race,OBOB Parent Group
the-million-dollar-race,content,110,what name does the ESPN photographer accidentally call Grant?,Greg,Matthew Ross Smith,The Million Dollar Race,Lake Oswego Public Library
the-million-dollar-race,content,121,"at what race did Grant fall at the finish line, with the video later going viral?",Penn Relays,Matthew Ross Smith,The Million Dollar Race,Lake Oswego Public Library
the-million-dollar-race,content,122,What is the name of the show Grant's family appears on with the host Jaime Freeman?,The Midnight Show,Matthew Ross Smith,The Million Dollar Race,OBOB Parent Group
the-million-dollar-race,content,129,how many subscribers/citizens did Grantsylvania have the first morning?,Seventy-five Thousand,Matthew Ross Smith,The Million Dollar Race,Lake Oswego Public Library
the-million-dollar-race,content,129,"how do people become ""citizens"" of Grantslvainia?",They subscribe to the youtube channel,Matthew Ross Smith,The Million Dollar Race,Beaverton City Library
the-million-dollar-race,content,131,what is the name of the late-night talk show Grant appears on?,The Midnight Show.,Matthew Ross Smith,The Million Dollar Race,Cedar Mill Public Library
the-million-dollar-race,content,133,What does Franny duct tape the GoPro camera to so Grant can broadcast around the clock?,a plastic crown,Matthew Ross Smith,The Million Dollar Race,OBOB Parent Group
the-million-dollar-race,content,133,what is the one natural resource that Grantsylvania has?,Grant,Matthew Ross Smith,The Million Dollar Race,Lake Oswego Public Library
the-million-dollar-race,content,136,What does it say above a picture of Jay on the cover of a magazine?,The Next Usain Bolt?,Matthew Ross Smith,The Million Dollar Race,OBOB Parent Group
the-million-dollar-race,content,137,What does Karl from the commune do now for work?,Uber driver,Matthew Ross Smith,The Million Dollar Race,OBOB Parent Group
the-million-dollar-race,content,137,who does the Falloon family find driving for Uber in California?,Karl,Matthew Ross Smith,The Million Dollar Race,Beaverton City Library
the-million-dollar-race,content,142,What is the Babblemoney Company's weakest performing demographic?,"youth sales, age 11-13",Matthew Ross Smith,The Million Dollar Race,OBOB Parent Group
the-million-dollar-race,content,142,what demographic is the weakest performing for the Babblemoney Company?,Youth sales,Matthew Ross Smith,The Million Dollar Race,Lake Oswego Public Library
the-million-dollar-race,content,145,What sport did Grandpa Falloon play?,football,Matthew Ross Smith,The Million Dollar Race,OBOB Parent Group
the-million-dollar-race,content,146,what was the last word that Grandpa Falloon said to Grantâ€™s dad?,Fine,Matthew Ross Smith,The Million Dollar Race,Lake Oswego Public Library
the-million-dollar-race,content,148,What do the protesters chant outside the Babblemoney estate?,No Nations left behind!,Matthew Ross Smith,The Million Dollar Race,OBOB Parent Group
the-million-dollar-race,content,150,How many outlet stores does Babblemoney have?,917,Matthew Ross Smith,The Million Dollar Race,OBOB Parent Group
the-million-dollar-race,content,150,how many outlet stores does the Babblemoney Company own?,917,Matthew Ross Smith,The Million Dollar Race,Lake Oswego Public Library
the-million-dollar-race,content,154,Where is the welcome party held for the Million Dollar race?,Babblemoney's sneaker museum,Matthew Ross Smith,The Million Dollar Race,OBOB Parent Group
the-million-dollar-race,content,157,Over how many days was the Million Dollar Race final competition?,2 days,Matthew Ross Smith,The Million Dollar Race,OBOB Parent Group
the-million-dollar-race,content,158,What surrounded the special 100 meter track built for the final competition?,TV towers,Matthew Ross Smith,The Million Dollar Race,OBOB Parent Group
the-million-dollar-race,content,162,How close was Grant's preliminary time to Jay's?,.01 seconds,Matthew Ross Smith,The Million Dollar Race,OBOB Parent Group
the-million-dollar-race,content,163,"when the Falloon family is staying in the luxury villa, what breaks in Grant's hand?",The mini-fridge,Matthew Ross Smith,The Million Dollar Race,Beaverton City Library
the-million-dollar-race,content,165,What does Franny steal from a warehouse?,a new pair of Babblemoney shoes (silver),Matthew Ross Smith,The Million Dollar Race,OBOB Parent Group
the-million-dollar-race,content,165,What does Franny discover Babblemoney has a warehouse full of?,Boxes of sneakers,Matthew Ross Smith,The Million Dollar Race,OBOB Parent Group
the-million-dollar-race,content,166,what does Franny say that a million dollars is to an advertising budget for a company like Babblemoney?,A drop in the bucket,Matthew Ross Smith,The Million Dollar Race,Beaverton City Library
the-million-dollar-race,content,172,name two of the teams in the Girls' Final Four Race.,"Any two: Brazil, Australia, Ukraine, or China",Matthew Ross Smith,The Million Dollar Race,Newberg Public Library
the-million-dollar-race,content,172,name 2 of the countries represented in the Girls' Final Four,"Brazil, Australia, Ukraine or China",Matthew Ross Smith,The Million Dollar Race,Beaverton City Library
the-million-dollar-race,content,173,Name 2 of the countries represented in the Boys' final four?,"USA, Jamaica, Japan, Grantsylvania",Matthew Ross Smith,The Million Dollar Race,OBOB Parent Group
the-million-dollar-race,content,173,Which countries were represented in the Boys' Final Four at the Mllion Dollar Race?,"USA, Jamaica, Japan, and Gransylvania",Matthew Ross Smith,The Million Dollar Race,OBOB Parent Group
the-million-dollar-race,content,175,Where will the winner of the Million Dollar Race be flown in Esther Babblemoney's private helicopter?,bank,Matthew Ross Smith,The Million Dollar Race,OBOB Parent Group
the-million-dollar-race,content,175,how does Babblemoney arrive to the final day of the race?,In a helicopter,Matthew Ross Smith,The Million Dollar Race,Beaverton City Library
the-million-dollar-race,content,176,What was the name of the new Babblemoney sneaker?,ZeroGravity 3000,Matthew Ross Smith,The Million Dollar Race,OBOB Parent Group
the-million-dollar-race,content,177,what is the name of the shoes that they introduced at the Million Dollar Race?,ZeroGravity3000s,Matthew Ross Smith,The Million Dollar Race,Lake Oswego Public Library
the-million-dollar-race,content,179,What did Grant and Jay share with the other runners on the morning of the final of the Million Dollar race?,pictures and videos from the sneaker factories,Matthew Ross Smith,The Million Dollar Race,OBOB Parent Group
the-million-dollar-race,content,179,What country did Adriano Santos represent at the Million Dollar Race?,Brazil,Matthew Ross Smith,The Million Dollar Race,OBOB Parent Group
the-million-dollar-race,content,180,what country is Maggie Olinyk from?,Ukraine,Matthew Ross Smith,The Million Dollar Race,Lake Oswego Public Library
the-million-dollar-race,content,181,Where was the winner of the girls' race from?,Brazil,Matthew Ross Smith,The Million Dollar Race,OBOB Parent Group
the-million-dollar-race,content,186,what does Grant's mom chant during the boy's semi-final race?,Everyone do your best! Everyone do your best!,Matthew Ross Smith,The Million Dollar Race,Beaverton City Library
the-million-dollar-race,content,192,What did Jay and Grant do instead of crossing the finish line in the final race?,sat down and lock arms (protest),Matthew Ross Smith,The Million Dollar Race,OBOB Parent Group
the-million-dollar-race,content,193,what do Grant and Jay do when they approach the finish line of the final in the Million Dollar Race?,"Sit down, back to back, and link arms",Matthew Ross Smith,The Million Dollar Race,Beaverton City Library
the-million-dollar-race,content,194,Who hacked into the giant HD screens and broadcast videos about the factory conditions?,Franny,Matthew Ross Smith,The Million Dollar Race,OBOB Parent Group
the-million-dollar-race,content,196,"what ""doinks"" down on Ms. Babblemoney's head as she tries to get away on her too-slow scooter?",A hot dog,Matthew Ross Smith,The Million Dollar Race,Beaverton City Library
the-million-dollar-race,content,204,where do the Falloons and the Fa'atasis go on rented bikes before leaving California?,The commune,Matthew Ross Smith,The Million Dollar Race,Beaverton City Library
the-million-dollar-race,content,206,whatâ€™s the name of the band on Grantâ€™s dadâ€™s â€œModern Draculaâ€ doll?,The Impalers,Matthew Ross Smith,The Million Dollar Race,Lake Oswego Public Library
the-million-dollar-race,content,207,What world record do Jay and Grant actually break together?,slowest 100 meter dash,Matthew Ross Smith,The Million Dollar Race,OBOB Parent Group
the-million-dollar-race,in-which-book,10,"does a character have an idea for a reality TV show called ""The Last Family on Earth""?",,Matthew Ross Smith,The Million Dollar Race,OBOB Parent Group
the-million-dollar-race,in-which-book,12,does a family ride around town as a peleton on bikes?,,Matthew Ross Smith,The Million Dollar Race,OBOB Parent Group
the-million-dollar-race,in-which-book,13,does someone get yogurt half off because it's past its expiration date?,,Matthew Ross Smith,The Million Dollar Race,OBOB Parent Group
