book_key,question_type,page,text,answer,author_name,book_title,source_name
better-with-butter,content,3,"who does Marvel choose to dress up as for her ""Famous Californian"" presentation?",Grandma Prisbrey,Victoria Piontek,Better with Butter,OBOB Parent Group
better-with-butter,content,3,What was Grandma Prisbey famous for?,Building a village out of recycled garbage,Victoria Piontek,Better with Butter,OBOB Parent Group
better-with-butter,content,4,What color is Marvel's wig for her famous Californian costume?,gray,Victoria Piontek,Better with Butter,OBOB Parent Group
better-with-butter,content,5,what is the name of the school that Marvel attends?,Bayside Academy,Victoria Piontek,Better with Butter,OBOB Parent Group
better-with-butter,content,5,What is the two word name of the school that Marvel goes to?,Bayside Academy,Victoria Piontek,Better with Butter,OBOB Parent Group
better-with-butter,content,7,Who does Marvel choose to do her famous Californian speech on?,Grandma Prisbey,Victoria Piontek,Better with Butter,OBOB Parent Group
better-with-butter,content,10,which musical instrument does Jamie bring for his Famous Californian presentation?,Trumpet,Victoria Piontek,Better with Butter,OBOB Parent Group
better-with-butter,content,13,what does Marvel say would be easier than saying her speech?,Jumping out of a plane,Victoria Piontek,Better with Butter,OBOB Parent Group
better-with-butter,content,196,Who offers to help with the set of the play?,Marvel's dad,Victoria Piontek,Better with Butter,OBOB Parent Group
better-with-butter,content,198,Who does Marvel want to play the lead role with Butter in the play?,Theo,Victoria Piontek,Better with Butter,OBOB Parent Group
better-with-butter,content,198,"Where does Marvel take Butter to practice the ""Leave it Command""?",garden,Victoria Piontek,Better with Butter,OBOB Parent Group
better-with-butter,content,223,What was hanging out of Ellie's backpack that made Butter want to lunge and grab?,a piece of paper,Victoria Piontek,Better with Butter,OBOB Parent Group
better-with-butter,content,226,What is Mercedes role in the school play?,Assistant stage manager,Victoria Piontek,Better with Butter,OBOB Parent Group
better-with-butter,content,228,What is Marvel's first role in the school play?,townsperson,Victoria Piontek,Better with Butter,OBOB Parent Group
better-with-butter,content,,What trick is Marvel trying to teach Butter to do for the play?,To kiss Grandpa at the end of the play,Victoria Piontek,Better with Butter,OBOB Parent Group
better-with-butter,content,3,Who does Marvel choose for her presentation on a famous Californian?,Grandma Prisbrey,Victoria Piontek,Better with Butter,OBOB Parent Group
better-with-butter,content,4,Who chooses to present on Mrs. Field and hand out cookies for their famous Californian presentation?,Addie Lucas,Victoria Piontek,Better with Butter,OBOB Parent Group
better-with-butter,content,6,What is the name of the principal at Bayside Academy?,Principal Huxx,Victoria Piontek,Better with Butter,OBOB Parent Group
better-with-butter,content,6,What is the last name of the principal at Marvel's school?,Huxx,Victoria Piontek,Better with Butter,OBOB Parent Group
better-with-butter,content,8,What is the first name of the character who makes chocolate chip cookies for the class?,Addie,Victoria Piontek,Better with Butter,OBOB Parent Group
better-with-butter,content,13,What is the name of Marvel's main teacher?,Ms. Day,Victoria Piontek,Better with Butter,OBOB Parent Group
better-with-butter,content,19,Who helps carry Marvel off stage with the principal when she freezes?,PE teacher,Victoria Piontek,Better with Butter,OBOB Parent Group
better-with-butter,content,38,What happens to the baby goat when she is scared?,faints/falls over and freezes,Victoria Piontek,Better with Butter,OBOB Parent Group
better-with-butter,content,42,What is Marvel's brother's name?,Reef,Victoria Piontek,Better with Butter,OBOB Parent Group
better-with-butter,content,46,What school subject is the book that Butter eats pages out of?,math,Victoria Piontek,Better with Butter,OBOB Parent Group
better-with-butter,content,67,What does Butter smell like when Marvel brings her home?,garbage,Victoria Piontek,Better with Butter,OBOB Parent Group
better-with-butter,content,80,What is Marvel's nickname for the pet store employee?,Goth Girl,Victoria Piontek,Better with Butter,OBOB Parent Group
better-with-butter,content,94,Why does Ms. Day text on her phone when the class is watching their famous Californian performances?,she is an aunt/her sister had a baby,Victoria Piontek,Better with Butter,OBOB Parent Group
better-with-butter,content,106,Where do Marvel and Addie take Butter when teaching her to walk on a leash?,pet store,Victoria Piontek,Better with Butter,OBOB Parent Group
better-with-butter,content,115,What do Marvel and Addie feed Butter to get her to walk on a leash?,Cheerios,Victoria Piontek,Better with Butter,OBOB Parent Group
better-with-butter,content,117,What is Jamie's nickname for Marvel?,Frosty,Victoria Piontek,Better with Butter,OBOB Parent Group
better-with-butter,content,121,How many lost animal fliers of Butter does Marvel print and put up?,three,Victoria Piontek,Better with Butter,OBOB Parent Group
better-with-butter,content,137,What is the name of Marvel's school counselor?,Mr. J,Victoria Piontek,Better with Butter,OBOB Parent Group
better-with-butter,content,138,Name one of the three people in Marvel's friendship group.,"Jamie, Keira, Kylie",Victoria Piontek,Better with Butter,OBOB Parent Group
better-with-butter,content,140,What do the letters ESA stand for?,emotional support animal,Victoria Piontek,Better with Butter,OBOB Parent Group
better-with-butter,content,153,How does Marvel pay the online money to register Butter as an ESA?,Reef's credit card,Victoria Piontek,Better with Butter,OBOB Parent Group
better-with-butter,content,178,Who convinces Principal Huxx to allow Butter at school temporarily?,her dad and Mr. J,Victoria Piontek,Better with Butter,OBOB Parent Group
better-with-butter,content,184,List two skills Butter has to demonstrate to stay at school as an ESA.,Leave it; walk on leash; respond to name; come when called; be friendly and adaptable,Victoria Piontek,Better with Butter,OBOB Parent Group
better-with-butter,content,235,What role does Mercedes talk Marvel into playing?,Peter,Victoria Piontek,Better with Butter,OBOB Parent Group
better-with-butter,content,237,Who is Marvel's best friend?,Addie,Victoria Piontek,Better with Butter,OBOB Parent Group
better-with-butter,content,245,Where is Marvel's favorite place to train Butter?,playground,Victoria Piontek,Better with Butter,OBOB Parent Group
better-with-butter,content,249,What does Butter eat while Marvel is helping Ms. Stewart move the desks?,state tests,Victoria Piontek,Better with Butter,OBOB Parent Group
better-with-butter,content,249,What is Butter doing that makes Principal Huxx call Marvel's dad and decide not to allow Butter at school anymore?,ate state testing papers,Victoria Piontek,Better with Butter,OBOB Parent Group
better-with-butter,content,253,What is Butter's owner's name?,Gloria Fizzle,Victoria Piontek,Better with Butter,OBOB Parent Group
better-with-butter,content,268,Who thinks Marvel is brave?,her brother or Reef,Victoria Piontek,Better with Butter,OBOB Parent Group
better-with-butter,content,271,Who is Marvel surprised to see at group therapy?,Jamie,Victoria Piontek,Better with Butter,OBOB Parent Group
better-with-butter,content,,Name two things Marvel has to do to move on to 7th grade.,"extra credit, not leave early, not get there late, attend every day, participate in the play",Victoria Piontek,Better with Butter,OBOB Parent Group
better-with-butter,content,13,What is the first name of the kid who gives his speech before it's Marvel's turn?,Theo,Victoria Piontek,Better with Butter,OBOB Parent Group
better-with-butter,content,18,what is the name the first person who starts pity-clapping after Marvel's presentation?,Ms. Day,Victoria Piontek,Better with Butter,OBOB Parent Group
better-with-butter,content,18,What is Marvel's last name?,McKenna,Victoria Piontek,Better with Butter,OBOB Parent Group
better-with-butter,content,19,Who helps Principal Huxx move Marvel off the stage?,PE teacher,Victoria Piontek,Better with Butter,OBOB Parent Group
better-with-butter,content,21,what grade is Marvel in?,6th,Victoria Piontek,Better with Butter,OBOB Parent Group
better-with-butter,content,22,what is the name of the school nurse?,Skippy,Victoria Piontek,Better with Butter,OBOB Parent Group
better-with-butter,content,27,what 2 things does Addie bring Marvel in the nurses's office?,Her backpack and a cookie,Victoria Piontek,Better with Butter,OBOB Parent Group
better-with-butter,content,29,What is the first name of Marvel's Mom?,Anne,Victoria Piontek,Better with Butter,OBOB Parent Group
better-with-butter,content,29,What is Marvel's Mom's ten digit phone number?,455-555-7555,Victoria Piontek,Better with Butter,OBOB Parent Group
better-with-butter,content,35,what is Jamie's older brother's name?,Matt,Victoria Piontek,Better with Butter,OBOB Parent Group
better-with-butter,content,35,What is the first name of Jamie's older brother?,Matt,Victoria Piontek,Better with Butter,OBOB Parent Group
better-with-butter,content,42,What is the first name of Marvel's older brother?,Reef,Victoria Piontek,Better with Butter,OBOB Parent Group
better-with-butter,content,43,What grade is Marvel's brother Reef in?,11th,Victoria Piontek,Better with Butter,OBOB Parent Group
better-with-butter,content,43,What branch of the military is Marvel's dad in?,navy,Victoria Piontek,Better with Butter,OBOB Parent Group
better-with-butter,content,44,what is Reef's girlfriend's name?,Suzanna,Victoria Piontek,Better with Butter,OBOB Parent Group
better-with-butter,content,44,What is the first name of Reef's girlfriend?,Suzanna,Victoria Piontek,Better with Butter,OBOB Parent Group
better-with-butter,content,45,What is the two-word name of the genetic disorder Butter has?,Myotonia congenita,Victoria Piontek,Better with Butter,OBOB Parent Group
better-with-butter,content,46,how much money does Marvel have in her savings account?,200,Victoria Piontek,Better with Butter,OBOB Parent Group
better-with-butter,content,46,"what object does Butter chew on to ""prove how good she is at foraging""?",Marvel's math book,Victoria Piontek,Better with Butter,OBOB Parent Group
better-with-butter,content,46,Which text book did Butter try to eat?,math book,Victoria Piontek,Better with Butter,OBOB Parent Group
better-with-butter,content,52,What is the four-word title of chapter 7?,How Your Garden Grows,Victoria Piontek,Better with Butter,OBOB Parent Group
better-with-butter,content,54,"what is a word commonly used in architecture to mean ""exit""?",egress,Victoria Piontek,Better with Butter,OBOB Parent Group
better-with-butter,content,59,what is Marvel's middle name?,Madison,Victoria Piontek,Better with Butter,OBOB Parent Group
better-with-butter,content,64,What is the first name of Marvel's Dad?,Jack,Victoria Piontek,Better with Butter,OBOB Parent Group
better-with-butter,content,66,Where does Marvel's dad suggest they keep Butter for the night until he can build a proper enclosure?,garage,Victoria Piontek,Better with Butter,OBOB Parent Group
better-with-butter,content,87,"which character is considered a ""chatterbox""?",Mercedes,Victoria Piontek,Better with Butter,OBOB Parent Group
better-with-butter,content,87,What is the first name of the character Marvel describes as a chatterbox?,Mercedes,Victoria Piontek,Better with Butter,OBOB Parent Group
better-with-butter,content,91,what is Ms. Day doing during class that prevents her from stopping the recording before it gets to Marvel?,Texting,Victoria Piontek,Better with Butter,OBOB Parent Group
better-with-butter,content,91,What was Ms. Day doing that distracted her from not stopping the video before Marvel's turn on stage?,texting,Victoria Piontek,Better with Butter,OBOB Parent Group
better-with-butter,content,95,what color leotards do Addie and Mercedes wear to dance?,Pale blue,Victoria Piontek,Better with Butter,OBOB Parent Group
better-with-butter,content,95,What are the first names of the three kids that Marvel used to do ballet with?,"Addie, Mercedes and Theo",Victoria Piontek,Better with Butter,OBOB Parent Group
better-with-butter,content,96,"When Marvel finds her Dad at the stove, what does she say the house smell like?",Vanilla cake,Victoria Piontek,Better with Butter,OBOB Parent Group
better-with-butter,content,101,what is Butter's reward treat when she walks on a leash?,Cheerios,Victoria Piontek,Better with Butter,OBOB Parent Group
better-with-butter,content,101,What treat does Marvel give Butter when she was trying to train her to walk on a leash?,cheerios,Victoria Piontek,Better with Butter,OBOB Parent Group
better-with-butter,content,104,what book do Addie and Marvel both love?,Penderwicks,Victoria Piontek,Better with Butter,OBOB Parent Group
better-with-butter,content,104,What does Addie suggest that Marvel try in order to get Butter to walk on the leash?,make a trail of cheerios,Victoria Piontek,Better with Butter,OBOB Parent Group
better-with-butter,content,105,What does Marvel want to buy at the pet store?,leash,Victoria Piontek,Better with Butter,OBOB Parent Group
better-with-butter,content,106,how long does the walk from Marvel's house to the pet store usually take?,10 minutes,Victoria Piontek,Better with Butter,OBOB Parent Group
better-with-butter,content,106,how much money does dad give Marvel to buy a leash?,20,Victoria Piontek,Better with Butter,OBOB Parent Group
better-with-butter,content,106,How many dollars does Marvel's Dad give her to buy a leash for Butter?,Twenty,Victoria Piontek,Better with Butter,OBOB Parent Group
better-with-butter,content,106,What does Addie use to make a trail to the pet store?,Cheerios,Victoria Piontek,Better with Butter,OBOB Parent Group
better-with-butter,content,106,How many dogs does Addie have?,Two,Victoria Piontek,Better with Butter,OBOB Parent Group
better-with-butter,content,111,what does Marvel purchase at the pet store for Butter?,leash,Victoria Piontek,Better with Butter,OBOB Parent Group
better-with-butter,content,114,what is the name of the Newfoundland that Addie and Marvel meet at the pet store?,Sonny,Victoria Piontek,Better with Butter,OBOB Parent Group
better-with-butter,content,116,Whose dog was nipping at Marvel's ankles trying to get to Butter at the pet store?,Jamie's,Victoria Piontek,Better with Butter,OBOB Parent Group
better-with-butter,content,116,Who owns the dog that tries to nip Marvel's ankles?,Jamie,Victoria Piontek,Better with Butter,OBOB Parent Group
better-with-butter,content,121,what is the title on the flyer Marvel makes?,Lost Creature,Victoria Piontek,Better with Butter,OBOB Parent Group
better-with-butter,content,129,What kind of car does Marvel's Mom drive?,Prius,Victoria Piontek,Better with Butter,OBOB Parent Group
better-with-butter,content,132,what page numbers did Butter eat out of Marvel's math book?,243 & 244,Victoria Piontek,Better with Butter,OBOB Parent Group
better-with-butter,content,132,What is the last name of Marvel's math teacher?,Spikes,Victoria Piontek,Better with Butter,OBOB Parent Group
better-with-butter,content,132,Which two page numbers of Marvel's math book did butter eat?,243 and 244,Victoria Piontek,Better with Butter,OBOB Parent Group
better-with-butter,content,148,"What kind of store does ""Goth girl"" work at?",Pet store,Victoria Piontek,Better with Butter,OBOB Parent Group
better-with-butter,content,151,What does ESA stand for?,Emotional Support Animal,Victoria Piontek,Better with Butter,OBOB Parent Group
better-with-butter,content,153,who does Marvel borrow a credit card from to join the ESA registry?,her brother Reef,Victoria Piontek,Better with Butter,OBOB Parent Group
better-with-butter,content,154,what does Marvel use as fabric to make Butter's ESA vest?,Reef's scrimmage pinnie,Victoria Piontek,Better with Butter,OBOB Parent Group
better-with-butter,content,154,Where is Marvel so excited to go to for the first time just because Butter will be with her?,School,Victoria Piontek,Better with Butter,OBOB Parent Group
better-with-butter,content,184,What skill is Marvel worried about Butter being able to perform for Mr. J?,Leave it,Victoria Piontek,Better with Butter,OBOB Parent Group
better-with-butter,content,187,"Which play do Addie, Theo and Mercedes suggest the class perform?",Heidi,Victoria Piontek,Better with Butter,OBOB Parent Group
better-with-butter,content,189,which play does the sixth grade class vote to perform?,Heidi,Victoria Piontek,Better with Butter,OBOB Parent Group
better-with-butter,content,208,What is the first name of the student who will play Heidi in the school play?,Addie,Victoria Piontek,Better with Butter,OBOB Parent Group
better-with-butter,content,208,What is the first name of the student who will play Grandfather in the school play?,Jamie,Victoria Piontek,Better with Butter,OBOB Parent Group
better-with-butter,content,214,Which friend does Marvel choose to come with her and Butter to meet the Kindergartners?,Addie,Victoria Piontek,Better with Butter,OBOB Parent Group
better-with-butter,content,230,which villain character would Theo rather be in the student show?,Aunt Dete,Victoria Piontek,Better with Butter,OBOB Parent Group
better-with-butter,content,234,What is the first name of the character who plays Peter before Marvel takes over?,Theo,Victoria Piontek,Better with Butter,OBOB Parent Group
better-with-butter,content,252,which character drives a white pick up truck with a trailer?,Gloria Fizzle,Victoria Piontek,Better with Butter,OBOB Parent Group
better-with-butter,content,252,What is the full name of the woman who owns Butter?,Gloria Fizzle,Victoria Piontek,Better with Butter,OBOB Parent Group
better-with-butter,content,275,"Why is Butter not eating when she goes home with Gloria, her owner?",she is greiving,Victoria Piontek,Better with Butter,OBOB Parent Group
better-with-butter,content,279,which bus stop does Marvel get off at to visit Gloria and Butter?,Fort Cronkhite,Victoria Piontek,Better with Butter,OBOB Parent Group
better-with-butter,content,,Who's credit card does Marvel use to buy the ESA certificate?,Reef's,Victoria Piontek,Better with Butter,OBOB Parent Group
better-with-butter,content,1,What does Butter wear to show that she is an emotional support animal?,A red vest with a tag that says ESA,Victoria Piontek,Better with Butter,OBOB.dog Community
better-with-butter,content,2,what does Marvel call her worries?,An armor.,Victoria Piontek,Better with Butter,Cedar Mill Public Library
better-with-butter,content,2,"Marvel's parents and school counselor call her worries ""anxiety."" What does Marvel call her worries?",Armor,Victoria Piontek,Better with Butter,Beaverton City Library
better-with-butter,content,3,what is the name of the historical figure that Marvel has to give a speech as?,Grandma Prisbey,Victoria Piontek,Better with Butter,Lake Oswego Public Library
better-with-butter,content,3,who does Marvel choose for her Famous Californian presentation?,Grandma Prisbrey,Victoria Piontek,Better with Butter,Beaverton City Library
better-with-butter,content,4,what did Addie Lucas get special permission for during her famous Californian presentation?,To hand out cookies,Victoria Piontek,Better with Butter,Beaverton City Library
better-with-butter,content,7,Why is Marvel afraid?,Because she has anxiety,Victoria Piontek,Better with Butter,OBOB.dog Community
better-with-butter,content,10,what instrument does Jamie play in Marvel's ear while they are waiting in line?,Trumpet,Victoria Piontek,Better with Butter,Lake Oswego Public Library
better-with-butter,content,14,what happens to Marvel when she's on stage during the Famous Californians presentation practice?,She freezes and gets carried off stage,Victoria Piontek,Better with Butter,Beaverton City Library
better-with-butter,content,22,who is Skippy?,The school nurse,Victoria Piontek,Better with Butter,Beaverton City Library
better-with-butter,content,26,"who says ""Sometimes life gives us more roadblocks than freeways""?",Skippy the School Nurse,Victoria Piontek,Better with Butter,Beaverton City Library
better-with-butter,content,32,what animal does Marvel find being bullied by 8th graders?,A goat,Victoria Piontek,Better with Butter,Lake Oswego Public Library
better-with-butter,content,32,"where does Marvel first see the baby goat, Butter?",On the sports field surrounded by a group of 8th graders,Victoria Piontek,Better with Butter,Beaverton City Library
better-with-butter,content,35,what does Marvel yell to get the 8th graders away from the baby goat?,Run! Principal Huxx is coming. Principal Huxx is coming,Victoria Piontek,Better with Butter,Beaverton City Library
better-with-butter,content,43,what grade is Reef in?,11th,Victoria Piontek,Better with Butter,Beaverton City Library
better-with-butter,content,46,"what object of Marvel's does Butter chew on, making it hard to do her Math work?",Marvel's Math book,Victoria Piontek,Better with Butter,Beaverton City Library
better-with-butter,content,47,what word is written in perfect penmanship inside the front cover of Marvel's math book?,New,Victoria Piontek,Better with Butter,Newberg Public Library
better-with-butter,content,76,who goes to a principal/parent/teacher meeting when Marvel's mom is working?,Marvel's Dad/Captain McKenna,Victoria Piontek,Better with Butter,Beaverton City Library
better-with-butter,content,87,name one of Marvel's groupmates in language arts?,"Addie, Mercedes, and Theo",Victoria Piontek,Better with Butter,Lake Oswego Public Library
better-with-butter,content,90,what is Theoâ€™s costume in the Famous Californian presentation?,Steven Spielberg.,Victoria Piontek,Better with Butter,Cedar Mill Public Library
better-with-butter,content,90,what is Ms. Day doing that distracts her from skipping the videorecording of Marvel's disastrous Famous Californian's presentation?,Texting or hearing news that her sister had a baby,Victoria Piontek,Better with Butter,Beaverton City Library
better-with-butter,content,91,what is Ms. Day doing that causes her to forget to skip Marvel's presentation during the video viewing of everyone's performance?,Texting,Victoria Piontek,Better with Butter,Lake Oswego Public Library
better-with-butter,content,93,"what mean nickname for Marvel is coined by her nemesis, Jamie?",Frosty,Victoria Piontek,Better with Butter,Lake Oswego Public Library
better-with-butter,content,99,what 2 things does Marvel and Reef's mom say are not allowed at the table?,Goats and phones,Victoria Piontek,Better with Butter,Beaverton City Library
better-with-butter,content,101,what cereal does Marvel use to train Butter to walk on a leash?,Cheerios,Victoria Piontek,Better with Butter,Lake Oswego Public Library
better-with-butter,content,101,what food does Marvel use to train Butter to walk on a leash?,Cheerios,Victoria Piontek,Better with Butter,Beaverton City Library
better-with-butter,content,114,who or what does Marvel meet at the pet store that introduces her to the idea of therapy animals?,Sonny the Newfoundland Dog / a Therapy dog,Victoria Piontek,Better with Butter,Beaverton City Library
better-with-butter,content,136,what seat does Jamie pick at Friendship group?,The bean bag chair,Victoria Piontek,Better with Butter,Beaverton City Library
better-with-butter,content,154,what does Marvel use to make Butter an ESA vest?,Reef's scrimmage pinny,Victoria Piontek,Better with Butter,Beaverton City Library
better-with-butter,content,173,what non-food item is Butter always attempting to eat?,Paper,Victoria Piontek,Better with Butter,Lake Oswego Public Library
better-with-butter,content,184,what skill is Marvel most worried about Butter being able to perform for Principal Huxx?,"Respond to the command ""Leave it""",Victoria Piontek,Better with Butter,Beaverton City Library
better-with-butter,content,187,what is the title of the end of year sixth grade play?,Heidi,Victoria Piontek,Better with Butter,Beaverton City Library
better-with-butter,content,208,what role does Jamie get in the 6th grade play?,Grandfather,Victoria Piontek,Better with Butter,Lake Oswego Public Library
better-with-butter,content,209,"what part does Theo want in the play ""Heidi""?",Aunt Dete,Victoria Piontek,Better with Butter,Beaverton City Library
better-with-butter,content,226,what does Mercedes call any tool she doesn't know the name of?,Doofer,Victoria Piontek,Better with Butter,Beaverton City Library
better-with-butter,content,237,which classmate slowly becomes Marvel's best friend?,Addie,Victoria Piontek,Better with Butter,Lake Oswego Public Library
better-with-butter,content,248,why does the third grader named Annie keep trying to interrupt when her teacher is talking to Marvel?,Because Butter is eating the test papers,Victoria Piontek,Better with Butter,Beaverton City Library
better-with-butter,content,252,what's the name of Butter's original owner?,Gloria Fizzle,Victoria Piontek,Better with Butter,Lake Oswego Public Library
better-with-butter,content,257,how does Mercedes replace Butter in the school play?,She has her little brother dress up as a Goat,Victoria Piontek,Better with Butter,Beaverton City Library
better-with-butter,content,271,what reason does Jamie give for being in group therapy?,His parents got divorced,Victoria Piontek,Better with Butter,Lake Oswego Public Library
better-with-butter,content,278,how does Marvel get to the farm to see Butter when she's sick?,Marvel takes the bus,Victoria Piontek,Better with Butter,Beaverton City Library
better-with-butter,content,299,who has very bad stage fright on opening night of Heidi and needs help getting on stage?,Jamie,Victoria Piontek,Better with Butter,Beaverton City Library
